,title
463,[1024 x 547] HMS Duncan Arriving in Cardiff
464,The oldest and newest carriers active in the US Navy in 1960... the USS Essex (CV-9) and Saratoga (CV-60) [960×768]
465,"The U.S.S. Indiana, her deck lined with Sailors and Marines, as seen from the Golden Gate Bridge, returning from the Pacific (Oct. 6, 1945). [1905 x 3000]"
466,"Everything You Ever Wanted to Know about American Second Generation SSNs (Permit, Sturgeon and Narwhal) [album]"
467,Not normally whats posted here. But I'm asking for a wavier. A narco-submarine seized in Ecuador in July of 2010. [1500×904].
468,"Crewmembers of USS ESSEX (CV-9) enjoy a swim in the lagoon of Majuro Atoll, April 1944 with USS IOWA (BB-61) at anchor in the background [3600 x 2860]"
469,"USS Connecticut running speed trials off Maine in 1906. Note the sailors crowding the rails, watching the photographer's boat, which is about to be swamped by the battleship's bow wave [6897x5612]"
470,An F/A-18 Super Hornet is directed onto the catapult on the flight deck of the aircraft carrier USS Theodore Roosevelt [1920×1371]
471,"[740 x 583] Battered and beaten, the IJN Aoba sits, settled in shallow waters after multiple hits from American air strikes during the 24th of April, 1945."
472,"HMS Warspite oiling the destroyer HMS Raider in the Sicilian Narrows, en route to Alexandria from Gibraltar, 3rd July 1943.[1640 × 1101]"
473,The Bridge of the USS Chancellorsville (CG-62) in the South China Sea [3000 x 1688]
474,Just the Yamato made out of Legos...link to more pics in comments.[1200x1603]
475,USS Ronald Reagan performing what looks to be a very tight turn [2100x1500]
476,"[650 x 494] USS Harry F. Bauer (DM-26) shown in a dazzle pattern, unknown location and time"
477,"Spanish Navy AEGIS Frigate Mendez Nunez (right) and left BAM Rayo (modular offshore patrol vessel, kind of multipurpose small corvette) (2592x1944)"
478,"Photo taken yesterday of USS Gerald R. Ford at sea, showing off the distinctively wide stern [5568x3712]"
479,Awesome picture of USS Seawolf. Steaming somewhere in the Pacific (3755x2513)
480,"'Enterprise'. A 35-ton steel plate on display at Newport News Shipbuilding during a ceremony to start advance construction of Enterprise (CVN-80). The steel plate will be part Enterprise's keel. This is the 9th USN ship to bear that name & 3rd Gerald R. Ford-class CVN. Aug 24, 2017. [800 × 533]"
481,"[666x 550] I lost my Grandpa today, He was 94 and drove landing craft onto Okinawa and the Philippines. This was his ship USS Dauphin. She survived until 1978 as the nations only floating dormitory"
482,"USS Oklahoma (BB-37), undergoing the parbuckle (righting) process eight months after being capsized during the Pearl Harbor attack. [2727x1863]"
483,"Propaganda photo of a man hand filing reduction gears at a GE plant, 1942 by Dmitri Kessel. Probably a warship, but could be for a Victory Ship [853x1280]"
484,The frigate Latouche-Tréville (D646) in a storm.[Gif]
485,"HMS Queen Elizabeth testing the ships pre-wet system. July 29, 2017 [1,328 x 747]"
486,USS Chicago (SSN-721) in drydock with Chigago Bulls emblem 1993 [1167 × 1589]
487,"USS John C Stennis (CVN-74) moored at Pearl Harbor, 2016 [4443 x 2957]"
488,USS Zumwalt (DDG-1000) [768 × 1146]
489,Dreadnoughts of the Royal Navy - Photos of every class of dreadnought battleship and battlecruiser built by the Royal Navy (except for carrier conversions) [Album]
490,Future Royal Navy carrier battle group [1440 × 960]
491,USS Missouri (BB-63) fires a six-gun salvo from her forward sixteen-inch guns turrets. The six projectiles are visible in flight at upper right of photo. USN Photo courtesy Getty Images. More info in comments. August 1944. [1024 × 855]
492,The U.S. 7th Fleet command ship USS Blue Ridge (LCC 19) [6120 × 3960]
493,"Bismarck firing on Hood and Prince of Wales, Battle of Denmark Strait, 24 May 1941. Photographed from Prinz Eugen. [740 x 430]"
494,"Aircraft carriers USS Dwight D. Eisenhower (CVN 69), USS George H.W. Bush (CVN 77), USS Enterprise (CVN 65), USS Harry S. Truman (CVN 75), and USS Abraham Lincoln (CVN 72) 2013 [2029×1636]"
495,"The Carrier of the Future! A drawing of the planned supercarrier USS United States (CVA-58), Popular Science Jan. 1949 [1621 × 648]"
496,LCS Donuts. USS Independence (LCS 2) demonstrates her maneuvering capabilities in the Pacific Ocean off the coast of San Diego. July 2013. [4485 × 2988]
497,Painting of the USS Archerfish sinking the IJN Shinano. The Shinano was the largest warship ever sunk by a submarine [Art] [1280 x 1024]
498,USS New Jersey (BB 62) passes through the Gaillard Cut during a transit of the Panama Canal [1500 × 1009]
499,Hull designs of stealth warships compared [6500x1450][OC]
500,[900x682] The incredible FULL SIZE reproductions of Roman Triremes made for the Sea Battle scene in the original 1925 BEN-HUR.
501,"[1200 x 900] Two Soviet behemoths pier-side together, an Oscar II SSGN and a Typhoon SSBN."
502,Russian submarine protecting a motor boat from big waves [800 x 533]
503,A Regulus II missile launcher being installed aboard landing ship tank USS King County (LST-857) [800 x 1004]
504,The aircraft carrier USS George H.W. Bush (CVN 77) transits the Gulf of Aden [1331 × 1064]
505,"Great Naval Weapons: Giant Guns - Their Muzzle-Energy, Projectiles, and Penetrating Powers, 1921 [1264×1823]"
506,Removing the forward torpedo tubes during scrapping of a submarine - maybe Oberon class. [1024×768]
507,"[2203 x 1239] Today in 1922, the United States commissioned it's first Aircraft carrier, USS Langley (CV-1). Here she is underway in June of 1927."
508,"USS George Washington (CVN-73) underway in the Pacific Ocean with Mt. Fuji in the background. Nov. 2009. [3,000 × 2,400]"
509,"Potential threat? Sailor at the bottom right has their rifle trained on me. HMS Sutherland, Plymouth UK, May 2012 [OC] [2048x1536]"
510,"Project 971 Akula in drydock at Rybachiy submarine base, Kamchatka peninsula [1772×1617]"
511,USS Missouri (BB-63). A 40mm barrel is seen impaled by a machine gun from the Japanese kamikaze hit off the coast of Okinawa on 11 April 1945. [800 × 605]
512,"The guided-missile destroyer USS Mustin receives a pallet of supplies from the fleet replenishment oiler USNS Rappahannock during an underway replenishment in the Sea of Japan, May 26, 2017 [4668×3112]"
513,"[2052x1455] 75 years ago today, one of the most beautiful carriers ever built was sunk at Coral Sea. Lady Lex, the U.S.S. LEXINGTON"
514,"USS New York and USS Texas light up the New York City night sky, May 3rd 1939, during the New York World's Fair [2000×1503]"
515,"BB-48 West Virginia looking sharp after her refit in 1944. Her old cage masts were cut down--replaced by a sleek, sexy superstructure. Sank at Pearl, raised and rebuilt, she participated in the last surface action of battleships, the night battle at Surigao Strait. AARP in comments. [1,200 x 891]"
516,Alaska-class large cruiser USS Guam (CB-2) moored at Pearl Harbor on 21 February 1945. The port catapult and aircraft crane are trained over the side. Guam served only 29 months on active duty. [2214 x 2824]
517,"Port side view of the Norwegian guided missile partol craft SKJOLD (P 690) underway in Ft. Washington, Maryland [2100x1500]"
518,"The future USS Gerald R. Ford (CVN 78) underway conducting builder's sea trials. Newport News, 4/8/17. Photo Ridge Leoni [4729 x 3148][OS]"
519,"USS Indiana (BB-58) fires a salvo from her forward 16"" guns at the Kamaishi, Japan Iron Plant. The forward mast of USS Massachusetts (BB-59) is visible directly behind Indiana. In the distance is most likely the USS Quincy (CA-71) due to her Measure 22 camouflage. July 1945 [3787 × 2839]"
520,[962 x 605] A Scottish fisherman built a 24ft 3in 1:40 Lego model of the USS Missouri! Links to articles in comments.
521,Ships and subs of the US Navy 2014. Graphic by Raytheon. [9525 x 7800]
522,Three Astute-class nuclear attack submarines in the build hall together. [1024x688]
523,"Naval Station, San Diego: Late 1940's mothball fleet [805x506]"
524,An extremely rare photo of the Russian carrier Kuznetsov firing a Granite anti-ship missile [1200 × 810]
525,HMS Illustrious leaving Portsmouth for the last time this morning [624x466]
526,Pre-dreadnought battleship HMS Victoria shortly before being launced in 1887.[1400 x 1792]
527,"Royal Navy battleship HMS Superb, only the fourth dreadnought-type ever built, steams down the River Tyne. Spring 1909."" [1920 x 1490]"
528,Gerald Ford Class Carrier human size reference. [752 × 960]
529,Congratulations /r/WarshipPorn! You're the subreddit of the day!
530,USS Theodore Roosevelt under way.﻿[674 × 1024]
531,"[1930 x 1462]We've built a carrier, but it looks boring... What if we slapped some cruiser turrets onto it?"
532,USS Constitution's hull in drydock
533,"Italian battleship Dante Alighieri in Taranto. Pre-dreadnought battleship and first built with her main armament in triple-gun turrets. It served as a flagship during WWI, but saw very little action. (1450x1398)"
534,"HMS Repulse leading other Royal Navy capital ships during maneuvers, circa the late 1920s. [3600 x 2913]"
535,"Lucky No. 13. USS Franklin (CV-13). View of the port side, amidships of the carrier anchored in lower New York Harbor, upon her arrival from the Pacific for battle damage repairs. 28 April 1945. [5785 × 3781]"
536,"USNS Mercy (T-AH-19) anchored off the coast of Legazpi, Philippines, 2016 [4011 x 2442]"
537,"HMS Hermione's cat, Convoy, asleep in his hammock, November 1941 [800x620]"
538,The Ronald Reagan and Abraham Lincoln strike groups break off from the Kitty Hawk strike group at the conclusion of Valiant Shield 06 [2947 x 1840]
539,"USS Independence (CVA-62) going under the Manhattan Bridge, New York, 1959. Note the tilted mast [1024×824]"
540,"German ""pocket battelship"" Admiral Graf Spee in Montevideo after the Battle of the River Plate.[2000 × 1231]"
541,LCS 6Jackson’s trimaran hull clearly shown this bow-on photo. [1024 x 685]
542,"The Great White Fleet [2,174 x 2,010]"
543,Kirov-class battlecruiser passing through the Suez canal. [1280 × 710]
544,"December 10th, 1941. USS Arizona view from ahead looking aft. (3000x2428)"
545,"HMS Royal Oak returns the body of Queen Maud to Norway, about 24 November 1938.[1909 × 1759]"
546,German zeppelin sinking in the Thames estuary April 1st 1916 [1280×781]
547,"There's not nearly enough love for the Gator Navy on this sub. So, I give you the USS Iwo Jima (LPH-2), lead ship in her Class of Amphibious Assault Ships. [2404x1831]"
548,"USS Wisconsin (BB-64) takes on fuel from HMCS Protecteur (AOR 509) somewhere in the Persian Gulf, November 1990[2019 x 2048]"
549,[2048X1087] Sailors assigned to the USS Coronado have a swim in the South China Sea
550,"USS Nimitz from the stern.Elliot Bay,Seattle.[2048 x 1082]"
551,[800 x 639] Sachsen class frigate F220 Hamburg sporting an unusual turret - somewhere a Leopard tank commander is scratching his head.....
552,"Leave it to the Italians to make beautiful ships, Littorio class of battleship, Vittorio Veneto.[2500 × 2000]"
553,Three Typhoon class nuclear-powered ballistic missile submarines [4672 × 3104]
554,"Comparing the 1990 Soviet Navy and Today's Russian Navy [OC][1,900x25,000]"
555,Advanced Mortar System twin 120mm turret on Swedish CB90Hs [1024x680]
556,USS Independence (LCS-2) in dry dock shows off her unique trimaran hull. (1152x1536)
557,"West Virginia (BB-48), Colorado (BB-45), Maryland (BB-46), Tennessee (BB-43), California (BB-44) and New Mexico (BB-40) firing broadsides off of California in February 1927.[640x397]"
558,Paris is suffering terrorist attacks. Post French ships. Here is the battleship Paris undergoing speed trials in 1914. [999x596]
559,"Submitted to r/pics a while back. Didn't get much attention, hopefully it does here. I took this photo about a year ago on the USS Texas.[2448x3264] [OC]"
560,[NSFW] What a nice rear HMS Dragon has! [4048x3036]
561,"After 4 years of construction, 3rd French frigate ""Languedoc"" join the Toulon navale base. [2048x 1151]"
562,"China Launches Newest Aircraft Carrier! Chinese Grandpa builds a carrier for his grandson Qingdao, China [840 x 560]"
563,HMS Queen Elizabeth with a Wildcat escort [3202x2135]
564,Smoke pouring out of the number two turret of USS Iowa after deadly explosion 1989 [3000×2123]
565,"For what would have been my late Grandfathers 114th birthday, here's the USS Missouri (BB-63) carrying some of his handiwork. As a foreman of a metalwork and pipefitting gang, he was assigned to build her seaplane recovery crane, shown here between her aft 40mm mounts. [2782x2309]"
566,USS Zumwalt arrives in San Diego[1918 x 2685]
567,"Lines have been dropped and gangways removed as HMS Queen Elizabeth prepares to leave Rosyth Dockyard for Sea Trials, 26th June 2017 [1200×900]"
568,"SSGN Saturday you say? You didn't? Oh well, here's a Project 949A Oscar II headed to sea anyway [1599 x 1104]"
569,German frigate F222 Baden-Württemberg from above in Wilhelmshaven [1024 x 683]
570,My Grandfather and I took roughly the same picture of the USS Becuna at Penn's Landing in Philadelphia about 30 years apart [OC 3000 x 2000].
571,"The Gearing-class destroyer Ernest G Small after losing her bow to a mine and subsequent heavy seas off Korea 1951. She made it back to Japan for repairs by steaming backwards. [2,273 x 1,647]"
572,"Firepower Friday! USS Iowa (BB-61) fires her 16"" guns while USS Saratoga (CV-60) conducts a underway replenishment with two unknown destroyers, 1987 [2,820x1,870]"
573,Korean ships firing full broadside [2048 x 1365]
574,A UH-46D Sea Knight hanging on the fantail of USS Suribachi (AE-21). The helicopter had a mechanical failure during an ammunition offload from USS Dwight D. Eisenhower [633 x 790]
575,"HMS Rodney trains her main armament to starboard, following astern of HMS Nelson[850x624]"
576,"USS Iowa, the largest warship designed to be able to traverse the Panama Canal, eeks its way through the locks for the last time, with inches to spare. 2001 - [1996×1297]"
577,"The bell from HMS Hood was successfully recovered from its wreckage on August 7th, 2015 by a team led by Paul G. Allen. Here are underwater photos of the recovery process. [Album]"
578,"Fat-bottom Girl: Unusual angle of USS Harry S. Truman (CVN-75), 2005. [2740x1800]"
579,Submarines in Their Natural Habitat [Album]
580,A U.S. Navy Seahawk helicopter lands on the Netherlands amphibious ship Johan de Witt [1800 × 1200]
581,USS Iowa refueling German destroyer Schleswig-Holstein [2840x1850]
582,"USS Hornet (CV-6) launching a B-25 Mitchell bomber during the start of the Doolittle Raid, April 18th, 1943.[768 x 510]"
583,"HMS Queen Elizabeth (R08) officially joins Royal Navy, 7th Dec. 2017. Commissioning ceremony replica cake which weighs around 150kg and required more than 7kg of flour and 160 eggs to make. [964 × 634]"
584,The best anti-air warfare ships of Europe [2048 x 1367]
585,Future Dreadnought-class submarine of the Royal Navy. They are eplacement for the Vanguard class of ballistic missile submarines. [1300 × 867]
586,A seven-mile line of steel rides at anchor in the Hudson River off New York City in celebration of Navy Day on 27 October 1945. [2500x3151]
587,Awesome sharks teeth on Russian Sub [1200 x 1851]
588,"[1024 x 643] A fairly advanced ship from one of the smaller navies in the world - The Omani corvette, Al-Shamikh."
589,"A rare find, S82 torpedo boats (1897-1898) of the Kaiserliche Marine with S-85 in front in 1909.[7000 x 5475]"
590,Shitty WarshipPorn. North Korean Patrol boat on the Yalu River [5472 x 3648] [OC]
591,USS Gerald Ford Sails Home After Tests [4928 x 3280]
592,[1280 x 840] Mk-45 vertical launching system on the USS Oklahoma City (SSN 723).
593,"The USS Enterprise CV-6, her distinctive Tripod Mast cut down to allow clearance, is pushed by tugs past New York City's Brooklyn Bridge on her way to Kearny, New Jersey to be dismantled for scrap, 21 August 1958. [700x993]"
594,USS North Carolina showing her forward 16 inch armament around September 1941 [1024 x 825]
595,"USS New Jersey (BB-62) fires her main 16"" 50 caliber and 5"" 38 caliber secondary guns, in the northern Pacific Ocean. [3600 x 2319]"
596,"Brazilian monitor Parnaíba: the oldest currently active, commissioned vessel in the world. Active since 1938 [460 x 675 ]"
597,Queen Elizabeth Class Aircraft Carrier Propeller [1500 × 1090]
598,"The Royal Australian Navy Skyhawk being an all-purpose aircraft, was the subject of a 1970s experimental sea trial of an A-4 on board a Royal Australian Navy submarine There was no objection from the aviators to operating the Skyhawk from the somewhat limited deck space of the submarine [800x494]"
599,Crew members use an NP-50 crane to remove a damaged Grumman F-14A-115-GR Tomcat from the flight deck after a barrier landing aboard the aircraft carrier USS Kitty Hawk (CV-63) on 30 June 1984 [2793×1842]
600,"USS JOHN S MCCAIN Arrives at Changi Naval Base, SG [1080 x540]"
601,Chinese sailors touring USS Sterett (DDG-104) [2250 x 1500]
602,F-14 Tomcat prepares for steam launch off of USS Harry Truman (CVN-75)[2100 x 1500]
603,"Firing solution computer, USS Alabama [OC][6016×4016]"
604,"[800 x 518] Launch of a P-270 ""Moskit"" supersonic anti-ship missile during the exercise Vostok 2014 (x-post /r/militaryporn)"
605,Battleship Nagato & crew[1417 x 1066]
606,Charle de Gaules Carrier Strike Group [1957x275]
607,"Remains of floating ""Mulberry B"" harbors off Gold Beach, Arromanches, as of 1990. Towed across the Channel on D-Day, some had gun emplacements and living quarters. [1,575px × 1,049px]"
608,"My dad recently finished this model of the U.S.S. Constitution. He started in 2002 and it took him 1,943 hours to complete. (x-post r/modelmakers) [Album]"
609,INS Vikramaditya : Inside India's Aircraft carrier [album]
610,Can you fit another AA gun on there? Late war USS Texas.[706x1000]
611,"River Class Offshore Patrol Vessel HMS Forth (P222) leaving the SBOH shed at Govan Shipyard, Glasgow, August 2016 [7000×4672]"
612,Croatian navy ships during Harpun 17 exercise [1200 × 840]
613,Nuclear icebreaker Taymyr (Таймыр) in 2005 [1800x1197]
614,"HMS St. Lawrence (1814), 112-gun first-rate ship of the line built by colonial shipwrights of Upper Canada on the waters of Lake Ontario. [1500 x 1000]"
615,"HMAS Voyager, HMAS Melbourne and HMAS Vendetta conducting jackstay transfers during a families day ( October 1959 ) [1000x557]"
616,My favorite ship: The French battleship Richelieu ![1962x1275]
617,"The next generation of US nuclear power. USS Gerald R. Ford (CVN-78) in dry dock, looking fresh! [3000 x 2002]"
618,"USS Nimitz (CVN-68) passes Mt. Baker as she departs Naval Station Everett for a scheduled deployment, 2013 [2100 x 1500]"
619,USS Freedom (LCS-1) [5374 x 3583]
620,Proposed design for Iowa class Battleship-Aircraft Carrier hybrid [1132×1200]
621,High Speed Turns - USS Harry S Truman [2442x1374]
622,"Launched this week - Expeditionary fast transport USNS City of Bismarck (EPF 9), Mobile, Alabama, June 7, 2017. [4109×2729]"
623,HNLMS De Ruyter looking menacing[1200×800]
624,"Four days ago, a malfunctioning SM-2 Blk IIIA missile exploded over USS The Sullivans shortly after launch [1280x855]"
625,Baltimore-class heavy cruiser USS Macon (CA-132) sneaking up to an unsuspecting cow.[2000 × 1262]
626,"The Soviet helicopter carrier Leningrad, date unknown. I tend to always find something nice to say about how a warships looks, but with this class i struggle.[1550 x 904]"
627,"One of my all-time favorite ship names: USS Shangri-La (CV-38). When asked where the Doolittle Raid on Tokyo was launched from Pres Roosevelt said 'Shangri-La', referencing a James Hilton novel, Lost Horizon. So the navy went off the deep end & named a long-hulled Essex after it! [3000x1904]"
628,"With a deckload of helicopters belonging to the 1st Air Cavalry Division aboard, the USS Boxer (LPH-4) prepares to depart for Vietnam in the fall of 1965. [755x1000]"
629,HMS Queen Elizabeth (R08) on sea trials escorted by HMS Sutherland (F81) (27/06/17) [960 x 720]
630,"Crew members man 20mm Oerlikon AA guns on the French battleship Richelieu, Indian Ocean, 1944. [1280 x 914]"
631,"Live WWII Torp. Officer in Charge, Explosive Ordnance Disposal Mobile Unit (EODMU) 2, relays information to unit ashore after identifying a World War II era torpedo caught in the nets of the fishing vessel 'Tara Lynn'. Cape Cod, MA. July 2002. USN photo. More info in comments.[1400 × 1050]"
632,"HMS X1, a British ""cruiser"" submarine which was the largest, most heavily-armed, and deepest-diving submarine of her time [2325x1618]"
633,"Olympias, a reconstruction of an ancient Athenian Trireme [1280 × 960]"
634,Yamato in the japanese movie The Admiral[Art].[1761 x 958]
635,"King George V-class battleship HMS Howe (32) passes through the Suez Canal on her way to join the British Pacific Fleet. July, 1944. [800 × 586]"
636,Casualties of the Royal Navy in The Battle of Jutland and comparison with other battles of the past [736x1012]
637,"Last Moments: under fire at pointblank range, HMS Glowworm (1,350 tons) closes to ram German heavy cruiser Admiral Hipper (18,200 tons) [744 × 619]"
638,"As a UH60M pilot, I flew down to my home state and toured the USS Massachusetts. We managed to get some great pictures, hovering along side. Sorry for the watermarks, but recently people have been stealing some of my photos. [1021x679]"
639,Tide-class replenishment tanker RFA Tidespring (A136) arrives at Gibraltar.[2048 × 1448]
640,"72 years ago today, representatives of the Empire of Japan formally surrendered to the Allies on the deck of the USS Missouri [5748 x 4504]"
641,"Incomplete German U-boats abandoned at the Blohm and Voss shipyard in Hamburg, 4 May 1945 [800×789]"
642,"'Krasnodar', a Project 636.3 (Advaned Kilo) submarine showing off her gorgeous screw. [1417 × 945]"
643,"Iowa class 16"" gun vs armor taken from IJN Shinano [462x620]"
644,French battleship Strasbourg lies scuttled in Toulon harbour as part of a planned effort by her crew to avoid being turned over to the Italian Navy. Nov. 1942. [1242 x 1482]
645,The Italian battleships Littorio and Vittorio Veneto at sea in 1942. [743 x 443]
646,"The burning of the English fleet off Chatham, 20 June 1667 by Peter van den Velde [1974×1294]"
647,[640 x 480] Rare pic from the control room of the Indian Navy's Akula II nuclear submarine INS Chakra II.
648,"HMS Ark Royal being dismantled in Izmir, Turkey, 2013 [970x744]"
649,HMS Queen Elizabeth floated out [2000x1333]
650,"Fragment of a 16 inch shell fired by the USS Massachusetts (BB-59), later recovered from 60 feet below the armored deck of the Vichy battleship Jean Bart [900x675]"
651,"A postcard from beautiful San Diego, 1946. [1280x881]"
652,"The US Fifth Fleet's Task Force 58 the largest single naval formation ever to make battle. [1,800 x 1,190]"
653,"Imperial Russian Navy Yermak, considered the first modern icebreaker, freeing the coastal battleship Admiral Apraksin in Gogland 97 ml west of St. Petersburg, 1900. Yermak remained in service until 1963. (1890x1299)"
654,"Submarine Silhouettes 1960, US Navy [2000×1486]"
655,"The Peruvian naval fleet flagship - and the last primarily gun-armed capital ship in the world, Almirante Grau (BLM-81), looking resolute and redoubtable at the Port of Callao, Peru (Picture taken March 26, 2007)(1177×616)(With bonus picture!)"
656,"I'm a bit of an Iowa class battleship nut, so here's a collection of some of the coolest, clearest, highest res images I've seen of them in action (lots of fire!) [Album]"
657,New artwork for the office
658,Virginia-class nuclear-powered guided-missile cruiser USS Arkansas (CGN-41) underway in the Atlantic on 1 September 1980. [5570 x 4486]
659,Surfacing sub with the shadow of a PC-3 Orion overhead [716 x 960]
660,Moving 16-inch gun projectiles aboard Battleship New Jersey 1953. (1986 x 1410)
661,Old Ironsides Underway with her topsails - USS Constitution [1442 x 1358]
662,Bismarck wreck (artist impression) [1559 × 1358]
663,"Antenna porn of the day: the A601 ""Monge"", one of the largest ships of the French navy [3216x2002]"
664,"North Korean submarine launching a torpedo during a ""Carrier strike exercise"" [1582x1046]"
665,High Vs. Low: USS Zumwalt sails with LCS USS Independence [4928 x 3280]
666,"F-14 ""Tomcat"" from the Diamondbacks of Fighter Squadron One Zero Two (VF-102) is launched from the bow catapult during flight operations [2244x1500]"
667,[750 x 545] X-post from WOWs Dunkerque gun installation. Incredible.
668,"[1024 x 878] HMS Shah (D21) moored in San Francisco with a load of Avengers, Wildcats and Warhawks for various British Empire nations. Jan 1944"
669,"USS Makin Island (LHD-8) transits the Arabian Sea under a clear night sky, 2017 [4203 x 2623]"
670,"Sailors aboard HMS King George V receive rum rations from a barrel labelled 'THE KING - GOD BLESS HIM', 1940 [800×607]"
671,"Battleship row, under attack and immediate aftermath. top picture taken by Japanese aircraft. [603 x 753]"
672,Royal Navy's Grand Fleet in the Firth of Forth 1914 [960×720]
673,Representatives of Japan stand aboard USS Missouri prior to signing of the Instrument of Surrender September 1945 [1000×795]
674,"Marshal Ustinov, first modernized Russian Navy Slava class cruiser, began 30-day sea trials today. [3733 x 2100]"
675,Evolution of the Essex class carrier.[3218x1793]
676,USS Iowa (BB-61) is launched at New York Naval Yard on 27 August 1942.[720 X 960]
