,title
233,HMS Invincible returns from the Falklands [3148 x 2361]
234,"The USS Fitzgerald (DDG-62) returned to Yokosuka Naval Base with the help of tugboats after its collision with the container ship ACX Crystal off the coast of Yokosuka, Japan. Add'l photo in comments. [1242 x 805]"
235,USS Iowa (BB-61) watches over a hatchling.[1024x684]
236,"Well, it has a gun. Steam-Pinnace-199, originally built in 1911.[2400x1800]"
237,World SSNs compared [OC][1209x1839]
238,"German Prinz Eugen Collision with Leipzig. At 2004 hours on 15-Oct-1944, the Prinz Eugen returned from an operation off Memel, the heavy cruiser accidentally rammed the light cruiser Leipzig. Took 14 hours before it was considered safe to separate both ships. (600x850)"
239,The Sampari-class KRI Halasan (630) leads a fleet of other fast attack craft with Air Force helicopters overhead in a ceremony commemorating the 69th anniversary of Indonesian Armed Forces [1600 x 970]
240,"An album featuring lots of subs and the drydock PD-50, the workhorse of the Russian Northern Fleet"
241,"Sailors from the USS Alaska (SSBN-732) assemble topside to commemorate the ships 100th patrol. June 15, 2017 [3,696 x 2,448]"
242,16 inch Naval Gun Rifling Cutting Bit [850 x 480]
243,HMS Queen Elizabeth next to the current largest ship in the fleet HMS illustrious. 634x570
244,The French Navy in 2017; absolute naval power![8695 x 5980]
245,"For my 200th post to r/WarshipPorn, I'd like to submit the pic which in my opinion is the very definition of WarshipPorn - I give you the USS Vincennes (CA-44) passing through the Panama Canal in January of 1938, lit by the tropical sun and slicing through the water as she turns to Port.[740x600]"
246,Portside AA turrets onboard Battleship Musashi with her officers and Emperor Showa[6588 x 4878]
247,"The Russian Navy polar icebreaker (the first such ship) ""Yermak"" tows the coastal-defense ship ""General Admiral Graf Apraksin"" off the rocks of Suursaari in the Baltic Sea, May 1898 [1200 × 800]"
248,"HMS Warspite, which served in both World Wars including in the Battle of Jutland in the Great War, ran aground in Prussia Cove, Cornwall, 1947.[1784 × 998]"
249,"Some 16"" big boys, laid out on the deck of USS Iowa.﻿[1500 x 2235]"
250,The Admiralty accomplishes what two world wars could not. The destruction of HMS Revenge 1948 [722 × 900]
251,USS Zumwalt sails past future USS Micheal Monsoor at Bath Iron Works [1920 x 1080]
252,"117 years ago today, the famous Pre-dreadnought battleship Mikasa was launched from Vickers, Barrow-in-Furness, UK. [1280 x 960]"
253,"HMS Queen Elizabeth, first of the new Queen Elizabeth class of carriers, moored in HMNB Portsmouth earlier this week. [3069x1206]"
254,Evolution of the USS Enterprise [1095×730]
255,"A ship that was hit 21 times by heavy caliber shells and a torpedo but refused to sink, battlecruiser SMS Seydlitz.[1219 × 730]"
256,"Nice shell capture. USS Vella Gulf (CG-72) fires her 5-inch gun, 2008 [2100 x 1274]"
257,USS North Carolina (BB-55) [16000x12000]
258,The Great White Fleet [2174x2010]
259,A busy day: HMAS Brisbane’s (D41) main 5-inch gun with expended shells from fire support during Vietnam War [1024 x 689]
260,Helicopters hover nearby while Russian Admiral Kuznetsov launches a plane. Pyotr Velikiy in the background [4656 x 2696]
261,"There are now 3 Carrier Groups and 1 Amphibious Ready Group in the Eastern Mediterranean. Kuznetsov, Charles de Gaulle, Eisenhower and Wasp. [Infographic update][OC]"
262,USS New Jersey. Well worth the trip. [1920x1080]
263,Bottsand-class oil recovery ship [1024 × 739]
264,"[2,100 x 1,378] Refueling at sea - quite literally as close to porn as it gets."
265,F18 of VX23 orbits USS Gerald Ford during tests[4968 x 3239]
266,F35 prepares to launch from the deck of USS America during tests[5472 x 3648]
267,"OMSK (K-186) Oscar-class cruise missile submarine, mid-life refit, 2008. [x-post /r/drydockporn][1000×750]"
268,Japanese Admiral Sankichi Takahashi on board the battleship Yamashiro[1140 x 1398]
269,"A head on view of the Mighty Hood, with the crew on deck for scale.[1702 × 2787]"
270,"The unfinished Italian aircraft carrier ""Aquila"" tied up at La Spezia sometime following Italy's surrender [4000 × 2481]"
271,USS Texas the last remaining dreadnaught (3264x2448)
272,"cutaway if latest Russian missile submarine, PR.0955A Borei-II drawn in MS Paint [OC] [2880 x 1440]"
273,4 USN nuclear subs being decommissioned through the Ship/Submarine Recycling Program at Puget Sound Naval Shipyard. Aerial view. (1500x2266)
274,"The Wreck of the Civil War Ironclad USS Cairo. Sunk by a mine in 1862, she is now on display in Vicksburg, Mississippi. She is one of only four Civil War ironclads to survive above water. [4,320 x 3,240]"
275,"Tens: The Crew of USS Yorktown (CV-10) spells out ハロー日本 (HaRo NiHon: Hello Japan), 1960 [740 × 580]"
276,An updated [album] of Soviet and Russian submarine propellers
277,"The former ammunition ship USNS Kilauea (T-AE-26) sinking after being struck by a Mark 48 torpedo fired from the Australian submarine HMAS Farncomb during a live fire training exercise, 24th July 2012 [1400×932]"
278,Like a Bat out of Hell: F-14 Tomcat wreathed in steam prepares to launch from USS Harry S. Truman (CVN-75). [2100x1500]
279,"Midway as you have never seen it! Exact moment of Yorktown's mortal blow captured on film, along with torpedo tracks, fighter-craft shadows and flak bursts. More in comments. [1200x800]"
280,The Tirpitz in Norway [1600 x 1099]
281,"Armoured deck goodness - HMS Implacable. Her sister, HMS Indefatigable, shrugged off a direct hit by a kamikaze to her deck and resumed flight ops within 30 minutes [4380 x 2256]"
282,Russian Akula-class fishing boat [1200 × 818]
283,"The carrier Philippine Sea (CVA 47) returns to port carrying transport planes in addition to airplanes of her embarked air group, 8/9/1952.[828 × 1024]"
284,The battleship USS Iowa (BB 61) leads its battle group. One carrier battle group on each side [2000 × 1592]
285,"[Album] 1/10 Scale Yamato Battleship, in Kure, Japan."
286,Unknown ship transits in front of USS Iowa[760x478]
287,HMS King George V secondary armament detail. Hi-res (5294x3874)
288,HSwMS M 21 (privately owned former minesweeper built in 1941) recently showed up outside my office window. [1800x1200][OC]
289,United States Air Force C-5 Galaxy disgorges a Navy Mark V Special Operations Craft [1800 x 2700]
290,Damaged to the USS Fitzgerald (DDG-62) sustained today after collision with merchant vessel. [1280 x 714]
291,"Aerial view of the American invasion fleet at Iwo Jima, March 17, 1945 [1200×707]"
292,USS Missouri on her shakedown cruise in 1944.[736 x 939]
293,The Russians hate her. Norwegian FS Marjata[1280 x 960]
294,"American Sailors of the USS Pillsbury complete the capture of their prize, the German U-505, the first warship captured by U.S. forces on the high seas since the War of 1812. [944 x 760]"
295,USS Zumwalt (DDG 1000) [2537 × 1592]
296,X-47B Unmanned Combat Air Vehicle sits on catapult of USS Theodore Roosevelt [2900 x 4096]
297,"America's first seagoing battleship, USS Iowa (BB-4).[3545 × 2256]"
298,Model of the HMS Duke of York inside the HMS Belfast in London [4032 x 3024][OC]
299,"HMS Warrior, the first battleship [Album][OC]"
300,The Navy's new rail gun that will be officially presented to the public in early February. Capable of firing a projectile over 100 nautical miles at six times the speed of sound [4817x2763]
301,"8-inch Japanese shell embedded in turret 1 of USS Boise (CL-47) after the battle of Cape Esperance, 1942 [2696 x 2076]"
302,"For my 200th post, here is my favorite image I have posted here: Unidentified German U-boat sinks Allied merchant vessel in the Atlantic, 1914 [940 x 713]"
303,"Jean Bart alongside cruisers Suffren and Montcalm, 1950s [616×804]"
304,"16"" shell being moved from its storage stall to ammunition hoist on the USS New Jersey, 1944 [801×776]"
305,The Swedish Navy in 2017[2880 x 2304]
306,"The Swedish cruiser ""Gota Lejon"" (""Great Lion"") camouflaged for war [1286 × 960]"
307,"No, this is the US Pacific Fleet. The US Fifth Fleet at anchor within the Ulithi Atoll. March, 1945 [2501 x 1894]"
308,Zubr-class hovercraft at sunset [1280x637]
309,"SSBN Dmitriy Donskoi in St.Petersburg, 2017 [1200x655]"
310,1/10th scale model of IJN Yamato at the Kure Naval Museum [640x480]
311,Everything you ever wanted to know about the Soviet Pr. 971 Shchuka-B SSN: known to us as the Akula [album]
312,Russian submarine Kursk after being raised [1024x768]
313,"The Royal Navys last battleship under construction, HMS Vanguard.[1147 x 1600]"
314,Cleaning a BL-15 inch Mk 1 naval gun at Coventry Ordnance Works during World War 1 [1024 x 765]
315,Worcester class anti-aircraft cruiser of the United States Navy [2754 x 2068]
316,"The game is on, French carrier Charles de Gaulle and his battle group departing today for eastern Mediterranean sea [994 x 640]"
317,World's Last Monitor: Brazil's Parnaíba [1120 x 840]
318,"Japanese aircraft carriers Kaga and Zuikaku, viewed from the stern of the carrier Akagi, sailing in the Northern Pacific Ocean en route to Pearl Harbor, early December 1941[992 x 672]"
319,A German rear-gunner poses with his machine gun in the tail of a WWI airship [1187 x 1772]
320,Row of AA 20 mm Oerlikon guns aboard the USS Hornet (2465x2617)
321,B-52 Bomber Buzzes The Soviet Aircraft Carrier Kiev[1200 x 836]
322,"USS Artisan (AFDB-1),a Large Auxiliary Floating Dry Dock, at Manus Island with USS Iowa in dock, 1944.[3000 x 2421]"
323,"I stumbled across ""The Battleship of the Future"" in a Popular Mechanics issue from 1940. [2698x2111][xpost /r/ImaginaryWarships]"
324,"Soldiers, Sailors, and Airmen of the Allied Expeditionary Force; You are about to embark upon the Great Crusade: Ships of the Allied Invasion Fleet arrive off the shore of Normandy in the biggest amphibious operation in human history.[1000 x 767]"
325,"(1200 × 675) Kirov Class Battle Cruiser 'Pyotr Velikiy', St. Petersburg 2017"
326,"The never-completed hull of Iowa-class battleship USS Kentucky (BB-66) March, 1955, about a year before the Navy removed her bow for transplant to the USS Wisconsin (BB-64)[2133x2014]"
327,"World's largest and heaviest surface combatant today, Pyotr Velikiy battlecruiser of the Russian Navy, passes the English Channel (Jan 24, 2017)[3000 x 1988]"
328,A very unique photo: the bow of Russian submarine K-84 Yekaterinburg (Delta IV SSBN) stripped bare after the fire in 2011 (sorry for the low res.) [604x453]
329,"The Italian battleship Littorio in La Spezia, spring 1943. [1400 x 748]"
330,"Soviet battleship Marat in Gdynia 1934, colourized by Irootoko_jr.[1200x900]"
331,A Diver kneeling below sunken Koni-class Frigate 383 [612 x 612]
332,"Five aircraft carriers, four amphibious assault ships, and more in Norfolk, Virginia [2580x1440]"
333,USS Nevada (BB-36) snugly tugged between four tugs.[3000 × 4641]
334,"USS Midway (CVA-41) en route to South-East Asia, April 1972 [1572×2015]"
335,"HMAS Sydney launching a Sopwith Camel. Platforms mounted on gun turrets was an innovative idea as it used space not otherwise useful, and allowed the platform to be turned into the relative wind without having to alter the ship’s heading (2744x2158)"
336,"Get ready for a surprise! HMS Campbeltown after ramming the dry dock at St. Nazaire, France, March 28, 1942. [1148 x 720]"
337,"On D-Day, 71 years ago today, began Operation Neptune, step 1 of Operation Overlord. [Repost from Colorized History][1400 × 1073]"
338,"PT-196 in the Philippines, sporting a shark-mouth paint job. [1542x821]"
339,"W. Churchill aboard HMS Prince of Wales on his way to meet with US President Franklin D. Roosevelt at the Atlantic Conference in Placentia Bay, Newfoundland. Aug 1941. The PoW had 4 months left before succumbing to Japanese torpedo-bombers near Singapore (800x785)"
340,"HMS King George V undergoing refit in a dry dock at Rosyth, Scotland 1940. [720 x 942]"
341,HMS Dragon transiting the Strait of Corryvreckan [2048 x 1365]
342,"Soviet Tango-class sitting in the snow, photo by Danila Tkachenko [1020 x 816]"
343,The Canadian Navy Frigate HMCS Winnipeg departs Esquimalt Harbour in the fog [2048 × 936]
344,USS America (LHA-6) [2302 × 1154]
345,"What was the absolute worst job in the pre-oil fired Navy? Coaling*. Several hours of bagging coal from a barge & moving them below deck. While in your white uniforms. A crew of a US pre-dreadnought coaling in 1919, Charleston Navy Yard. [3765x5451]"
346,"Sea Fury and Firefly aircraft on the snow covered flight deck of HMS Theseus, off the west coast of Korea, 8th December 1950. [OS] [800x607]"
347,A C-130 Hercules takes off from the deck of the carrier USS Forrestal (CV-59) 1963. [1200x760]
348,"The French heavy destroyer Fantasque on trials in Casco Bay, 13 June 1943. Fantasque and her sisters were the fastest class of destroyers in WWII, capable of a blistering 45 kts [1103 × 1072]"
349,"Battlecruiser HMS Repulse, her sinking proved that large surface ship no longer could operate without air support.[2400 x 1446]"
350,"Portrait orientation: HMS Queen Elizabeth on second day sea trials, escorted by HM Ships Sutherland and Iron Duke [2400x3000]"
351,German battleship/battlecruiser Scharnhorst underway.[1150 × 841]
352,"French landing ship dock Ouragan (L 9021), her stern gate open for landing craft operations, at sea during the NATO Southern Region exercise Dragon Hammer 90. [1,000 × 900]"
353,"Aircrew learning how to identify vessels at sea using models on the Tactical Floor in No. 3 School of General Reconnaissance at Squires Gate, Blackpool, Lancashire, April 1944 [800×612]"
354,Zumwalt heads out to sea for the first time this morning on sea trials! [1001x733]
355,A U.S. Navy submarine plays peekaboo with Russian battlecruiser Pyotr Velikiy [800×563]
356,Can anyone identify this warship?[640x396]
357,USS Bennington sails past Arizona - 1958 [740x588]
358,[1000x541] Typhoon Class Dmitry Donskoy in Transit
359,"The brightest moon in almost 69 years sets behind the aircraft carrier USS Theodore Roosevelt in Coronado, Calif., Nov. 14, 2016 [6639 × 4426]"
360,"The German pocket battleship Admiral Graf Spee in flames after being scuttled off Montevideo, Uruguay, after the Battle of the River Plate. 18 December, 1939. (Coloured by Royston Leonard) [960x635]"
361,The Arleigh Burke-class guided-missile destroyer USS Lassen (DDG 82) patrols the eastern Pacific Ocean. [3000 × 1937]
362,"Soviet Kirov Class nuclear-powered guided missile cruiser Frunze, 1986 [2660×1780]"
363,"The HMS Rodney, downfall of the Bismarck. [1204 x 767]"
364,Submarine sonars: an album of American and Soviet bow sonar arrays and towed sonar arrays
365,"SSV-33 Ural, a soviet communications ship that served in electronic intelligence, missile tracking, space tracking, and communications relay roles.[1240 × 872]"
366,The Royal Canadian Navy by the end of 2017 [2400 x 1632]
367,[736 × 857] SS Growler (SSG 577) from the bow with a Regulus ready...1959
368,"Task Force One, the world's first nuclear task force, sailing around the world in 65 days without a single refueling or replenishment.[1062x786]"
369,"Soviet command ship SSV-33 'Ural', NATO reporting name 'Kapusta' (Cabbage). Based on the hull of the 'Kirov' class missile cruisers. Not a happy ship - story in comments! [3000 x 2311]"
370,German submarine U-805 in 1945. The US Navy took U-805 on several Victory Visits to ports on the east coast before sinking her.[700x881]
371,"USS Hercules (PHM-2) bow-on. She was a Pegasus-class missile hydrofoil, armed with a 76mm OTO and two quad-packs of Harpoons. Foil-borne, she could dash at 48 knots. Source for this pic is the cover of a Boeing brochure uploaded to foils.org [1899 x 2458]"
372,"What, no French pre-dreads yet? I give you my favorite: the Charles Martel (1280×885)"
373,"My own repost from 9 months ago. USS Midway CV-41 & USS Iowa, BB-61 Battle Group Arabian Gulf ~ December 1987 [481 × 600]"
374,"USS Batfish (SS-310) in her final resting place at Muscogee, Oklahoma. [2592x1944]"
375,Most beautiful colorized photo I've seen. Charles Martel French Pre-Dread (Repost) [1081 x 638]
376,"Essex Class Carrier Modernizations [3,218 × 1,793]"
377,"The amphibious assault ship USS Essex (LHD 2), and the Japanese Maritime Defense Force (JMSDF) ships Shimakaze (DDG 172), Myoukou (DDG 175), Hamagiri (DD 155) and Natusio (SS 584) pier-side Okinawa, 2003. [3200×400]"
378,Missouri in the Atlantic - August 1944[420x860]
379,The German Battleship Bismarck [1280 × 1119]
380,Imperial Russian Navy Battleship Navarin in 1902. Colorized by Irootoko Jr [1600 x 1179]
381,"Steam submarine, a British K-class steam powered submarine that did not succeed (720x328)"
382,"[4608 x 2592] USCGC Eagle (WIX-327) in New York harbor, August 11, 2017 [OC]"
383,Iowa repair[1024 x 826]
384,"A 16.14 inch gun (41cm) from the Japanese battleship 'Mutsu' on display outside the Yamato Museum. October 2008. [3,264 × 2,448]"
385,"USS Illinois, SSN-786, under construction [2048x1159]"
386,"USS Alaska (CB-1) maneuvers in front of USS Missouri (BB-63) during their shakedown cruise, circa August 1944 [1974 x 3000]"
387,"USS Arizona (BB-39) at the United States' post-First World War naval review in New York, December 1918 [3000×2325]"
388,"Rollout of USS OMAHA (LCS 12) at Austal USA - Mobile, Alabama, 2015. [1200×900]"
389,My 500th post on the greatest subreddit ever. What is likely the largest piece left of the greatest warship to sail the seas. The Stern Plate Of The USS Enterprise (CV-6) [1024x683]
390,Screw me from behind - La[f]ayette class SSBN [750x585]
391,The Russian Cruiser Aurora [2560×1707]
392,Photo of Manhattan @ end of WWII (xpost - /r/pics) [1122 x 750]
393,"Admiral Kuznetsov"" - Tractor with a jet engine on its decks! [1280x960]"
394,Russian aircraft carrier Admiral Kuznetsov in the English Channel off Dover on Oct 21st 2016 [2048x1909]
395,The famous 1/10 model of the IJN battleship Yamato [6016x4000]
396,German U-Boat Wreckage Emerges Off the Coast of Kent after almost a 100 years. [964×712] [Album].
397,[2870 x 1895] An AV-8S Matador overflies SNS Dédalo (R-01) likely in the mid 1990's.
398,USS Gambier Bay being bracketed by Japanese Shells during the Battle off Samar. Gambier Bay was the only US carrier to die to surface guns during the war. [3600 x 2843]
399,USS McCain loaded aboard M/V Treasure for transport to Japan for repair. [960x720]
400,"HMS Victorious (S29), the second Vanguard-class submarine of the Royal Navy. [1800 × 1279]"
401,HMS Queen Elizabeth and the USS George H.W. Bush side by side [1200x551][OS]
402,British Revenge-Class Battleship during Spithead Maneuvers in 1935 [2560x1440]
403,Last of the Gunfighters [793x1024]
404,HMS Invincible being welcomed home by numerous private craft upon returning from the Falklands conflict [720 x 589]
405,"Awesome picture of the USS Nimitz. My buddy works on a tug boat that helped maneuver it out of port in Everett, WA."
406,"Musashi being struck by a bomb, forward of #1 turret, Sibuyan Sea, 24 October 1944. [740 x 542]"
407,Gods of MADness - world nuclear missile submarines compared [OC][4000x1700]
408,The Queen's Dragon - HMS Dragon escorting HMS Queen Elizabeth [2048x1638]
409,"The USS Sable (IX-81), 1943, conducting training operations on Lake Michigan. She and the USS Wolverine (IX-64) trained 17,820 pilots in 116,000 carrier landings, and are the only fresh water, coal-driven, side paddle-wheel aircraft carriers ever used by the United States Navy. [2777x1771]"
410,"HMS Victorious on ""loan"" to the US Navy, anchored in the Solomons July,1943[900x398]"
411,USS Zumwalt. I miss the old days.[600x450]
412,A collection of pictures I took during my 5 years onboard (DDG-92) USS Momsen. [OC] [ALBUM]
413,"The guided-missile cruiser USS San Jacinto (CG 56), and Udaloy-class destroyer Admiral Chebanenko steam alongside each other.[2100 × 1401]"
414,North Korea's newest stealth corvette that was recently spotted [4072 x 2080]
415,Open door on the USS New Jersey (BB-62) showing the 17 inch citadel armor of the Iowa-class [2850x1920]
416,[OC] USS Alabama (BB-60) emerges from the mist over Mobile Bay[6000 x 4000]
417,Norwegian Skjold-class corvette covered in ice [2048×1365
418,Long Slumber: Present-day wreck of USS Yorktown as rendered by National Geographic. [1600x970]
419,u/whattisthisthing finds a Soviet submarine communications buoy on the beach in Hawaii (more info in comments) [album]
420,Open ballistic missile hatches on Typhoon class SSBN [2900 × 1884]
421,My Duct Tape Bismarck
422,Modernization! USS Yorktown (CV-10) after her1953 SCB-27A modernization (left) and after her 1956 SCB-125 modernization (right). [1020x725]
423,"USS Winston Churchill (DDG-81) makes a high speed run in the English Channel, 2001 [1312 x 2000]"
424,sailor on the USS New Jersey (BB-62) operates the ships throttle. Jan. 1983 [1100 x 727]
425,[gif] Aircraft lays a 'curtain' of smoke for ships. This 'curtain' is produced by a mixture of ammonium sulfide & potassium persulfate [718 x 404]
426,All Aboard the USS Bundle of Sticks! [639x430]
427,Cutaway of Stalin's Super Sub - Project P2. Drawn in MS Paint and shaded in GIMP. [OC] [X-post] [4000 x 1888]
428,"Aboard Taiwan's submarine ROCS Hai Pao, formerly USS Tusk (SS-426), which at 71 years old, is capable of still laying mines but can no longer fire torpedoes. [2043 x 1311]"
429,"Damaged twelve-inch gun of the fore turret of the Russian battleship OREL, shortly after she was captured by the Japanese in the Battle of Tsushima, 28 May 1905. [1972 x 1594]"
430,HMS Inflexible guns. Turret cross-section showing guns pointing downwards for reloading. 16-inch (406.4 mm) 80-ton muzzle-loading rifles. (1194x606)
431,"A friend of mine is working on the restoration of the USS Constitution. I now get restoration updates via Facebook, which is rad. [960 x 720]"
432,"Royal Navy dreadnought HMS Superb emerging from the darkness, spring 1909. Her masts have been stepped down so she can pass under bridges as she makes her way down the River Tyne after construction. [1024x798]"
433,Shells in flight: various naval guns captured as they fire [album]
434,The Queen of Quads: Richelieu-class battleship Jean Bart tears up the seas on her speed trials (1949)[1183 x 1711]
435,"One tough lady. USS Alchiba (AKA-6) burns at Guatalcanal. She was torpedoed on 28 November 1942, her crew ran her aground to off load supplies and fight fires, she burned for six days, refloated, torpedoed again on 7 December, and still finished WWII. [1780 x 1396]"
436,Top Gear Russia Magazine Accidentally Published An Image Of A Classified Submarine [1200x900]
437,USS Missouri (BB-63) at Pearl Harbor.[640x906]
438,A German helicopter departs from HSwMS Nyköping during the exercise Northern Coasts in the Baltic Sea [1200 x 800]
439,"The Soviet Navy's sole Papa class submarine. She was extremely expensive, built from Titanium and the fastest attack sub ever, reaching a top speed of 44.7 knots [2979x2313]"
440,The airship K-69 launches from the deck of the escort carrier Mindoro (CVE 120) c 1950.[1024 × 809]
441,Last remaining gunboat from the Gallipoli campaign has been restored & unveiled (X-post Militaryporn) [962 x 686]
442,USS Zumwalt heading out for her second round of sea trials in the Gulf of Maine. [2048x1365]
443,The Royal Navy's modified Courageous-class battlecruiser HMS Furious (47) she appeared extensively camouflaged in 1942. Colorized photo by irootoko_jr. Add'l info in comments. [1280 × 880]
444,The sun rising over San Jacinto battlefield and USS Texas (BB-35)[1084x720]
445,"HMS AMBUSH (S120) Astute-class nuclear fleet submarine, BAE Systems, Cumbria, England, 2011. [615×943]"
446,"On the coast of the Caspian Sea the revolutionary ekranoplan ""Lun"" is rotting on its berth. [1350x900]"
447,USS Zumwalt (DDG-1000) [3636 × 2380]
448,"A B25 bomber attacks Japanese warships including No.13 class submarine chaser HIJMS CH-39 off Three Island Harbor, New Hanover during World War II. [1124 x 1470]"
449,"The aircraft carrier USS Theodore Roosevelt, the guided missile destroyer USS Halsey, and the guided missile cruiser USS Bunker Hill steam in formation during a strait transit show of force exercise in the Pacific Ocean, Aug. 11, 2017 [1920 × 1006]"
450,French AA Cruiser Colbert (C611) [3200 x 2332]
451,[1280x 1040] Yamato turret cutaway with Tiger tank for scale. Stumbled upon this and thought I'd share with you guys
452,"A carrier and a battleship: USS Midway (CV-41) conducts an underway replenishment with the battleship USS Iowa (BB-61). [2,853 × 2,141]"
453,"[1024 x 751] USS Ticonderoga (CV-14) underway, Monday, 8 May 1944, the day she went into commission."
454,"A typical day in the life of Able Seaman Gaze on board HMS Anson, 16-19th AUgust 1942. [ALBUM]"
455,"Recommissioned for the Vietnam War, USS New Jersey (BB-62) was little modified. She is shown here underway off Oahu, Hawaii, 11 September 1968, with all three turrets and 5"" mounts trained to port. Bonus photo in comments. [1416 x 1122]"
456,"[2782 x 2197] USS Baltimore, shown in San Francisco late in1951 after her re-activation for the Korean War. (Note ship's band is playing on the fantail)"
457,HMS HERMES (British aircraft carrier 1919) [3600 x 2780]
458,HMS Nelson between the wars [800 x 607]
459,Russian submarine graveyard in the Murmansk Oblast [1180×787]
460,A Camouflaged Swedish Navy Ship [1286 × 960]
461,Royal Navy losses of WWII [736 x 1012]
462,"HMS Hannibal in 1854. A 90 gun 2nd rate ship of the line , served in the Crimean War and Italian War of Independence. Survived until 1904.(1500x1119)"
