,title
677,"Former United States Navy Ship Kilauea breaks apart and sinks following a torpedo attack from the Collins Class submarine HMAS Farncomb, on the Pacific Missile Range Facility (PMRF) off Hawaii, during RIMPAC 2012. [1003x667]"
678,"Battle Group Echo in formation ~ November 1, 1987 [1.600px × 1.280px]"
679,"U.S. Navy and South Korean ships transit the East Sea in a 13-ship formation led by the Los Angeles-class attack submarine USS Tuscon, July 26, 2010. [2157 × 1298]"
680,"French armored cruiser Dupuy de Lôme. circa 1890, intended to attack enemy merchant ships as its primary mission (1450 x 1021)"
681,"HMS Minerva's Lynx HAS2 on ASW mission, 1987.[1051 × 1400]"
682,"German battleship Scharnhorst photographed in the fall of 1939, after completion of her July-August 1939 refit [3600 x 2026]"
683,Scharnhorst at Wilhelmshaven in Color [487 x 676]
684,USS Growler Diesel Sub (1958) with Regulus 2 missile launcher [800 x 600]
685,"The US Navy's newest ship, The USS Somerset (LPD 25). To be commissioned Saturday 1 March 2014., the ship is named in honor passengers of United Airlines Flight 93 that crashed near Shanksville, Pa., in Somerset County during the 9/11 terrorist attacks. [3000x2075]"
686,"Type 001A, China's second aircraft carrier and first one built domestically after being launched. [900 x 500]"
687,"5"" shell casings litter the deck of USS New Jersey (BB-62) after 1,600 rounds were fired overnight. Gulf of Tonkin, 1969 [1921 x 1499]"
688,"The damaged bow of battleship USS Wisconsin, after a collision with destroyer USS Eaton [1280 × 834]"
689,"HMS Vanguard, she was the only ship of her class and was the biggest, fastest and last of the Royal Navy's battleships.[1920x1265]"
690,[1200 x 2148] French carrier battle group deployment [OC]
691,Raising of German U-Boat U-534 [Album] (Article in comments)
692,"Scrapping of ex-Murmansk, Soviet cruiser aground off Norway [2722×1814]"
693,"[960 × 554] 1935 - July 16th - KING GEORGE V SILVER JUBILEE REVIEW - The Cunard liner BERENGARIA, homeward bound from New York for Southampton, passes behind HMS RODNEY and between the rows of battleships"
694,USS Omaha (LCS 12) [3226 × 2419]
695,Vvvvrrrrrrrrppp!! A Phalanx close-in weapons system fires during a live-fire exercise aboard the amphibious assault ship USS Boxer (LHD 4).[1935x2002]
696,"USS Missouri towers over visitors in drydock, Hawaii. [1224x792]"
697,HMS QUEEN ELIZABETH at the end of the rainbow [2048 x 1365]
698,"KMS Admiral Graf Spee in Montevideo, 1939.[966 × 1420]"
699,My 500th post!.Essex-class aircraft carrier USS Ticonderoga refuels from USS Ashtabula off Vietnam in 1966.[4502 x 3553]
700,Crewmen of a U.S. Navy aircraft carrier banish post-battle nervous strain by taking a swim in the warm waters of a lagoon in the Marshalls only a few days after laying siege to and conquering Roi Island in the Kwajalein atoll. [2048x 2283]
701,"The future guided- missile destroyer USS Zumwalt (DDG 1000) departs the Bath Iron Works shipyard for its second at-sea period to conduct builder's trials, during which many of the ship's key systems and technologies will be demonstrated [6144 × 4096]"
702,HMS Rodney firing a five gun salvo during the 1930s.[1350x1126]
703,One of 2 flamethrower turrets on a US Navy River Monitor (Flame/Zippo 1) in action. Vietnam 1969.[3000 x 2400]
704,HMS Victory is 250 years old today. Happy Birthday Old Girl! [1600 X 1063]
705,Imperial Chinese Navy Cruiser Yangwei. View of one of the Armstrong Whitworth 254 mm cannons that formed its main armament (2048x1580)
706,[1025x597] HMS Dreadnought (S101) - first nuclear-powered British submarine
707,"HMS Illustrious cut into pieces at demolition site in Aliaga, Turkey [960 x 640]"
708,USCGC Eagle under full sail in 2013 [1776 x 1275]
709,"74 Years Ago Today. Model of USS Hornet (CV-8) with B-25 Mitchell bombers on deck, preparing for Tokyo Raid, April 18, 1942. Wisconsin Veterans Museum. [3,648 × 5,472]"
710,Apache helicopter aboard HMS Illustrious [2709x1806]
711,"High resolution sonar image of Yamashiro at the bottom of Surigao Strait, found by the crew of the RV Petrel. More info in comments. [1611 x 971]"
712,The High Seas Fleet heading out in 1914.[2000 × 1370]
713,"A up close view of the damage to the USS John S. McCain (DDG-56) sustained after a collision with a commercial vessel, August 21 2017, [1200 x 801]"
714,"Bridge of attack submarine USS TOLEDO (SSN-769) underway in Persian Gulf, 2004. [1312×2000]"
715,"HMS Vanguard entering No1 Dock, Gibraltar, 1953.[800 × 597]"
716,HMS Victory - a 104-gun first-rate ship of the line [2547 x 3000]
717,"An American sailor inspects aircraft ""hangar"" of the captured Japanese submarine I-400. The I-400 class was designed to carry and launch up to three Aichi M6A Seiran aircraft from a water tight compartment. Aug '45. [1600 × 1294]"
718,I found a photo of my Dad cooking a barbecue on top of a moving Submarine x/post /r/pics (1730x1182)
719,"Japanese Surrender aboard the USS Missouri Sep. 2, 1945. (1033x1280)"
720,An album of American nuclear submarine propulsors (screws and pumpjets) in roughly chronological order
721,"An F/A-18 Super Hornet launches from the flight deck of the forward-deployed aircraft carrier and flagship of Carrier Strike Group Five, USS Ronald Reagan (CVN-76), during Annual Exercise 2017. Philippine Sea, 20 Nov 2017. USN photo. [5941 x 3215]"
722,[2233 x 2844] USS Los Angeles (CA 135) at Mare Island 20 July 1954
723,"A pair of beautiful sisters, battlecruisers HMS Renown and HMS Repulse.[3000 x 1997]"
724,"USS Missouri (BB-63) and USS Kitty Hawk (CV-63), refueling from USNS Kawishiwi (AO-146) in July, 1986. [3000x2010]"
725,USS Macon counts as a warship. No discussion. Vroom vroom. [4320x3549]
726,"HMS Belfast, view from a ferry, beer in one hand camera in the other {3937x2625]"
727,"A Mark 9 turret from USS Louisville (CA-28) rusting away in the Nevada desert. It once served in Lawrence Livermore National Laboratory's nuclear testing program for the purposes of a rotating radiation detector, collecting data on nuclear tests. Mark 9's were of 8""/55 caliber is size. [1027 × 630]"
728,"USS Samuel B. Roberts (DE-413), ""the Destroyer-Escort that fought like a Battleship"", an epitaph earned for engaging an enemy fleet consisting of 4 battleships, 6 heavy cruisers, 2 light cruisers, 11 destroyers, including the Yamato.[800x519]"
729,Various naval guns undergoing maintenance at South Korean Navy ammunition depot [4752 x 2792]
730,The most fearsome weapon in the Navy's arsenal (cross-post /r/pics) [2877 × 1620]
731,Battleship Bismarck taken from a Swordfish [720 x 413]
732,SMS Scharnhorst rolls over and sinks while SMS Gneisenau continues to fight [800 × 482]
733,"[xpost historyporn] USS ARIZONA, December 25, 1916, on her way back from sea trials. Taken from the Manhattan Bridge on the East River, New York City. Note the Christmas trees atop both cage masts. [4104 × 3215]"
734,"Size comparison of the battleship USS Missouri (BB-63) moored near the ""large cruiser"" USS Alaska (CB-1) [3159 x 2632]"
735,An album of one of my favorite classes of submarines: the Project 705 Alfas
736,USS Zumwalt [3456 × 3648]
737,View from a German submarine of a British transport being hit by a torpedo 1941 [4843×3340]
738,"Top down photo by Danish forces of Russia's battlecruiser Pyotr Velikiy or ""Peter the Great""[1134 x 756]"
739,"Rare aerial photo of Bismarck moving through the Kaiser Wilhelm Canal to the Baltic Sea, March 8, 1941. [1024 x 685]"
740,"In memoriam of the the fast transport Swift (HSV-2), which has reportedly sank after a missile attack off the Yemeni port of Mokha on the Bab al Mandeb. She was operated under charter for the UAE Army at the time. Purported video of the attack and aftermath in the comments. [2100x1011]"
741,[2400 x 3300] All the US Navy aircrafts in a single graphic - organized by squadron. [OC]
742,12 Billion tax payer dollars of pure sexy. U.S.S USS_Gerald_R._Ford_(CVN-78) [1072x611].
743,HMS Nelson... beautiful in a warship way![1449x1603]
744,"And Away She Goes. DDG 1000, USS ZUMWALT heading out to sea enroute to her formal commissioning. 7Sep2016 [960x720]"
745,USS Zumwalt DDG 1000 and USS Monsoor DDG 1001 pier side at Bath Iron Works (2048x1356)
746,"The USS Iowa crosses the Panama Canal at Miraflores Lock near Panama City, Panama Wednesday, March 28, 2001 [2000 × 1312]"
747,"""I fear all we have done is to awaken a sleeping giant and fill him with a terrible resolve."" [2,777 x 2,243]"
748,"The United States Navy as part of the Sixth Battle Squadron with Rear Admiral Hugh Rodman, by Burnell Poole.[944.619][Art]"
749,The German Navy by the end of 2016 [1824 x 1344]
750,"An elevated view of the attack submarines Ray (SSN-653), Hawkbill (SSN-666), and & Archerfish (SSN-678) surfaced at the geographic North Pole, 6 May 1986 during ICEX 86. This is the first time three nuclear-powered submarines have simultaneously surfaced at the pole. [3000 × 1982]"
751,The world's only Battleship Division underway in the Persian Gulf during Operation Desert Storm; this is Missouri (BB-63) and Wisconsin (BB-64) between gunfire missions. [620x327]
752,"Swedish warships at anchor in Karlskrona, 1935 - photos by my great-aunt, found in my parents' basement [Album][OC]"
753,LST's pouring army equipment ashore on Leyte Island in the Philippines 1944 (Navy) [2785x2269]
754,"The only nuclear sub to sink an enemy vessel - HMS Conqueror returns from the Falklands, flying the Jolly Roger for a confirmed kill [1024 x 723]"
755,"British nuclear powered attack submarine HMS Talent surfaces during trials [3,600x2,486]"
756,"HMS Manchester, damaged by an aerial torpedo in the Mediterranean in 1941. Two men stained with fuel oil taking a breath of fresh air on Manchester deck after being rescued from lower deck damaged by the attack. An AA Bofors land piece can be seen too added as reinforcement. (800x529)"
757,USS George Washington fires one of its forward Phalanx CIWS during a live-fire drill [3000 x 1997]
758,"Armidale-class patrol boat HMAS Glenelg (ACPB 96) prior to its launch from the Austal shipyard in Henderson, Western Australia, 2007 [1146×775]"
759,"USS John S. McCain DDG-56 in the South China Sea. The Navy is reporting that 10 sailors are missing after she collided with an oil tanker off Singapore early Monday morning. [1,088 × 726]"
760,"Lego HMS Queen Elizabeth [1,199 x 657]"
761,"USS Ronald Reagan (CVN-76) off the coast of Caloundra this am, on 'er way to Brisbane after Talisman Sabre [4032x3024]"
762,"Audacious class aircraft carrier, HMS Eagle (R05).[1480 x 1904]"
763,"What's left of HSV-2 Swift, after being hit by an AShM [1920*1214][low quality, sorry. More pics inside]"
764,Rare sight - someone just blew up two Islamist armed trawlers in Libya [900 x 785]
765,SEAL caught in the act of infiltrating the Russian submarine Severodvinsk [1632 x 1224]
766,Don't mind me I'm just gonna take a little nap. A walrus on an Oscar II? class submarine [1608x1170]
767,"The flagship (technically the only ship, so we'll call it a flagship) of the Mongolian Navy, Sukhbaatar III, is a tugboat manned by 7 men, only one of whom knows how to swim. [500x372]"
768,"The wreck of Kikutsuki, sunk in 1942, salvaged by the US Navy in 1943 (1944)[5819 x 4582]"
769,On a model of the planned German aircraft carrier Graf Zeppelin smoke measurements of the aerodynamics for landing aircraft were carried out in the Göttinger wind tunnel. 1937. [1566 × 982]
770,"Cruiser in the front, carrier in the back. The FS Jeanne d’Arc (R97) showing off her 100 mm guns, Exocet missiles, and helicopter flight deck [2000 x 1346]"
771,Can you say Tomcat? Aerial view of USS Independence (CV-62) and USS Midway (CV-41) moored at Naval Station Pearl Harbor. Aug. 1991. [2830 × 1850]
772,"A BL 18-inch Mk 1 naval gun arrives at England's Imperial War Museum in London, ca. 1920. It was the largest and heaviest gun ever used by the British. The Second-World-War Japanese had a larger calibre at 18.1 inches, but the British shell was heavier. [800 x 600]"
773,Riding high with the US Navy's Pegasus-class hydrofoil [736x763]
774,"Finnish coastal defence ship Väinämöinen camouflaged against a hill, July 1944 [1600×1180]"
775,"USS LCS-102 as she appears today at Mare Island. Over 900 of these 158-foot craft were built, each kcapable of 16 knots while carrying a full company of infantry. [1798 x 1011]"
776,Submarines of Europe [4500x4000][OC]
777,"1 USS New York, which was built with 7.5 short tons (6.8 t) of steel salvaged from the World Trade Center to commemorate the victims of 9/11 in the Hudson River on Nov 2nd, 2009 [3888×2592]"
778,How to SCB-27C & SCB-125 Your Carrier in 13 Easy Steps! [Album]
779,Superstructure for days! A rather fetching view of Piotr Velikiy lying at anchor. [3390x2216]
780,The crew of the aircraft carrier USS MIDWAY (CV-41) mans the rails as the ship arrives at Pearl Harbor 1991 The USS ARIZONA Memorial is in the background at upper right. [2840×1880]
781,Lynx Helicopter Fires Flares At Sunset Over The Destroyer HMS Dragon [1600x944]
782,"Russia Cruiser Moskva entering Valletta Grand Harbour, Malta, 2004. [800 x 534]"
783,USS Missouri having her superstructure restored. Taken on the USN's Birthday 10/13/17[OC][4271×2837]
784,USS New Jersey BB-62 moored in the Delaware River[4032x3024]
785,Deck of the USS Zumwalt (DDG 1000) [5534 × 3680]
786,German cruiser GNEISENAU in 1899 [3600 x 3072]
787,"Her Majesty's Troopship 'Olympic', sister of the famous 'Titanic', carrying troops home from WWI in 1919 [2514 × 1941]"
788,USS Philippine Sea (CG-58) fires her third Tomahawk Cruise Missile towards ISIS/ISIL targets during combined strikes last night. [2100x1400]
789,HMS Hood in New Zealand as part of her world cruise.[3405 × 2558]
790,"USS Nimitz, INS Vikramaditya, and JDS Izumo sail in formation yesterday during Exercise Malabar [3599x1479]"
791,Real Italian submersible boat design from cold war (see comments) [OC][2000 x 500]
792,"HMS St Lawrence, a 112-gun first-rate that served on Lake Ontario during the War of 1812. Built at Kingston, she was the only Royal Navy ship of the line ever to be launched and operated entirely in fresh water. [1,632 x 1,814] [Art]"
793,White Oak trees are delivered to the USS Constitution in drydock for use in her restoration [1024x741][OS]
794,Models being made of Pearl Harbor battleships...amazing work. Album in comments.[2048x1645]
795,"Cab of a US Navy K-Class blimp. 134 of these blimps were built, carrying 4 depth charges, radar, sonobuoys, and MAD gear. [2560x1920]"
796,"After the front fell on - future HMCS Harry Dewolf Arctic/Offshore Patrol Vessel AOPV-430 with all three ""megablocks"" in place, December 8, 2017[3872x2581]"
797,"A lesser known Bismarck! USS Bismarck Sea, underway, 24 June 1944 (1024 x 849)"
798,For the day of Christmas Eve I give you the ship that started a new age: HMS Dreadnought firing broadside.[1886x2632]
799,"The ghostly hunk of the CSS Hunley, the first combat submarine to sink a warship, hanging in a conservation tank early after her recovery. [980 x 552]"
800,"USS Carl Vinson (CVN-70) standing in under a fog-shrouded Golden Gate Bridge. Date not certain, possibly Oct 2011. [xpost /r/pics] [1600 × 1034]"
801,USS NEW JERSEY (BB-62) anchored in Newport Harbor at sunset. Circa 1986. [3629x2246]
802,"HMS M1 a ""submarine monitor"" armed with a single 305mm gun[1090x817]"
803,Russian Oscar II class submarine in dry dock [1200 × 900]
804,"Voronezh, Oscar-class submarine of Russian Navy, rescues 5 people off an 11-meter boat. The boat, Barents-1100 ran out of fuel in rough weather in northern White Sea on 9 June 2014 [800x533]. Photo by EMERCOM."
805,"So I know I'm late to the 10,000 subscriber party, but in honor of reaching this milestone, here's a little project I've been working on: a photo album of the 200+ battleships commissioned since the launch of Dreadnought. [Album]"
806,"The Italian destroyer Camicia Nera. Ironically enough, for a ship named after the Blackshirts, after World War II she was transferred to the Soviet Union. [1440 x 1752]"
807,Mine countermeasures ship USS Avenger (MCM-1) during her initial shock test in 1987. An explosive device was placed beside the ship and detonated in order to simulate a mine explosion [1500×1202]
808,USS Iowa at Dry Dock [1600 × 1311]
809,the 'other' nuclear carrier: Charles de Gaulle (R91) [4096x2721]
810,"As of today, I've been on Reddit for nine years. So here's a great photo of CV-9, USS Essex, making waves during a Mediterranean cruise in January 1960. A C-1 Trader cargo plane prepares for takeoff at the stern, while Skyraiders and Skyrays populate the deck. [4816x3749]"
811,U.S. Navy and Japan Maritime Self-Defense Force ships are underway (4288 x 2848)
812,USS North Dakota (SSN 784) Will be commissioned today 10/25/14 at 11 A.M. Link in comments [960x638]
813,"Gotcha! ARA General Belgrano sinking after an attack from HMS Conqueror, May 2, 1982. [893x581]"
814,"Fighting till the end, HMS Warspite grounded at Mount`s Bay on her way to the breakers in 1947.[1600 × 1111]"
815,USS Franklin listing alongside the USS Santa Fe. The carrier had been hit and set afire by a Japanese dive bomber during the Okinawa invasion [1000 x 768]
816,"[Album] How to load a 14"" gun on board the USS Texas as well as a few other photos. [OC]"
817,Just wondering how many on here knew about the unique deck edge elevator on the USS Wasp (CV-7)? More pics in comments.[1158x899]
818,"Who else is tired of F-18's? USS Ranger in August 1961 Showing off the diverse array of aircraft in her air wing, plus a couple 5"" turrets. [2000x1242]"
819,NATO flotilla [2923 × 1945]
820,South Korean destroyer and corvettes open fire with their guns [1280 x 852]
821,"Russian cruiser ""Varyag"" in Philadelphia, 1901 [1294 x 1000]"
822,"Estimated Damage report against Surface Ships in the Air Attack on Pearl Harbor, Dec 8th, 1941. (Japanese assessment in the aftermath of the military strike) [964×739]"
823,Timeline of aircraft carriers of the United States Navy [1400×876]
824,"""Full speed ahead and damn the navigation aids"", the ""Honda Point Disaster"", seven destroyers in less that seven minutes [566x394]"
825,The evolution of US nuclear attack submarines [GIF][3000x1000][OC]
826,21 gun broadside. USS New Jersey (BB-62) [2978 × 2267]
827,Military Strength chart. [2500 × 4869t]
828,Heavy seas [550px × 395px]
829,"This is what a warship looks like in our parts of the world. Osebergskipet, viking era, circa 800AD [2048x1399]"
830,"The Italian battleship Andrea Doria in Taranto, late summer of 1942. [1055 x 559]"
831,"Italian Navy Day - MAS 15, which sank SMS Szent Istvan on 10 June 1918. [1012 x 632]"
832,Japanese helicopter destroyer and American aircraft carrier [3500 × 2336]
833,US nuclear cruisers [1600 × 1265]
834,"USS Texas Hard Hat Tour: A view of off limits to the general public, unrestored spaces [album] [OC]"
835,One heavy-lift ship carrying two Akula-class nuclear attack submarines. [Album] Xpost from /r/Military
836,"Ripples appear on the fuselage of an E-2C AEW aircraft from the stress of landing. USS Harry S. Truman (CVN 75), 2005. [2100x1500]"
837,"The USS Gerald R. Ford (CVN 78) transits the Atlantic Ocean on a starry night. December 13, 2017 [5,472 x 3,648]"
838,"USS Saratoga (CV-3) passing through the Gaillard Cut in the Panama Canal, Feb 1928.[1024x823]"
839,"The amphibious assault ship USS America (LHA 6), one of 40 ships and submarines representing 12 international partner nations, steams along during a group sail as part of exercise Rim of the Pacific 2016 [3903 × 2602]"
840,"Obsolete destroyers and submarines at Philadelphia Navy Yard, 28 October 1940 [6500×4766]"
841,"Fantail's awash. Seawater spills over the fantail of USS Iowa (BB-61) during high power maneuvers in shallow waters at Chesapeake Bay, VA, 19 November 1985. [2000 × 1326]"
842,PLAN Amphibious Landing in the Zubr-Class LCAC [2000 × 2974]
843,"Crew unload mail from two C-2A Greyhounds aboard USS George Washington (CVN 73), Indian Ocean, 2011 [4256×2832]"
844,"Remarkably, this picture of USS Arizona (BB-39) had not been posted in warshipporn. With President Herbert Hoover on board, returning from a cruise to the West Indies, 29 March 1931. Photographed by a USAAC plane from Langley Field, Virginia. Note the President's flag on the mainmast. [3948x3624]"
845,Japanese Battleship Nagato in the early days of her long career.[5228 x 4228]
846,"My son flew out to stay with Grandma for a week. Not three hours after landing, he sends me this picture. USS George Washington (CVN-73) Naval Station Norfolk, 3 Jul 2016[2048 x 1536]"
847,"A fine view of the sheer scale and complexity of the big gun turret for a Battleship. In this case, this appears to be a British 15"" gun mounting, of the type mounted on R class batlleships, ""Queen Elizabeth"" class [549 × 640]."
848,"[1030 x 710] Tirpitz in color, Norway, 1942"
849,Collection of Photos from the 31st MEU [OC]
850,"Farewell Indy. The last of the Forrestal-class supercarriers afloat, the decommissioned ex-USS Independence (CV-62) arrived at her final port of call over the weekend and was greeted by several of her past crewmembers who gathered for one more goodbye. [900 x 677]"
851,"HMS Lancaster makes us wish this isn't photoshopped [2239 x 2798] Merry Christmas, WarshipPorn!"
852,"HMS Duke of York, HMS Nelson, HMS Renown and HMS Formidable of the North African coast in support of Operation Torch, November 1942. [OS] [800x603]"
853,"The ironclad turret ship HMS Devastation of the Royal Navy. Launched in 1871, Devastation was the world's first ocean-going capital ship to mount the entire armament above the hull, as well as the first to go totally without sails [3468 × 2364]"
854,HMS Ambush damaged during collision with commercial ship today [1024x630]
855,"The HMS Bounty, right, and USS Niagara sail the waters of Lake Erie off Cleveland for the Battle of Lake Erie Reenactment, 7 2010[684 x 974]"
856,"[887 x 900] 'Aloha to Hawaii' formed on the USS Badoeng Strait's (CVE-116) flight deck by over two hundred mishipmen as the carrier arrives at Pearl Harbor June 30, 1950"
857,Italian heavy cruiser Zara during the Battle of the Mediterranean.[1895 × 1288][Art]
858,[1873 x 1056] An Italian submarine Todaro-class/U-212A loading a 533 mm WASS Black Shark torpedo
859,"[1450 × 957]Impressive view of the brand new HMS Queen Elizabeth, the cutting edge of naval technology."
860,Salvage divers working after the attack on Pearl harbor 1941 [740×605]
861,The giant building block set that will become the next Ford-class aircraft carrier - John F. Kennedy (CVN 79).[960×639]
862,"Shock blast detonated off the starboard side of USS Theodore Roosevelt (CVN-71), September 19, 1987. The test was conducted to demonstrate the carrier’s ability to withstand underwater shock waves. [750x617]"
863,"Vittorio Veneto-class battleship Roma, one of the most famous victims of the world's first precision guided weapon, the Fritz X.[3072×1827]"
864,"Weapon-class destroyer HMS Broadsword (D31) at high speed, after her conversion to a radar picket.[799 x 1024]"
865,The officers and crew of the Arleigh Burke-class guided-missile destroyer USS Mustin (DDG 89) pose for a group photo under the ship's screws at Fleet Activities Yokosuka [2100 × 1500]
866,Legend class cutter of the United States Coast Guard (infographic) [2781x 1860]
867,Japanese torpedo gyroscope [768x1024]
868,"US Fleet at anchor in Guantanamo Bay, 1927 [2329x1829]"
869,Skjold-class superfast stealthy corvettes of the Norwegian Navy [album]
870,"Sailors forming a poppy on the flight deck of the Type 23 frigate HMS Lancaster (F229), 2013 [1200×800]"
871,Spanish Segura class minehunter ESPS Duero (M35) carefully transits the narrows of the Corinth Canal [606 x 911]
872,USS America (LHA-6) departing from LA.[1700 x 1133]
873,"May 28 1977. President Carter looking unimpressed aboard the newly commissioned USS Los Angeles. Note Admiral Rickover on the far right staring deep into your soul. [1,280 × 873]"
874,"USS George Washington (CVN-73) transits the wind-blown Strait of Magellan on November 1st, 2015. [3000x1980]"
875,Battleships! [3000 x 4093]
876,"The resolution is a bit small but the firepower sure isn't, HMS Rodney, HMS Hood and HMS Nelson in one picture.[960 × 673]"
877,"Coal for Christmas? Nah, the really bad kids get JDAMs. Santa aboard USS Constellation (CV-64), 2002 (x-post r/militaryporn) [3000 x 2004]"
878,2 Islands? I Raise You a Super Island [1600x1200]
879,25 November 1941: Sailors jump from the hull of the HMS Barham as she capsizes and her magazines explode. [GFY] [xpost /r/militarygfys]
880,DDG 1000 Zumwalt in the cold [1200 × 799]
881,Built my 1/700 scale LCS 2 on keel blocks just so I can take a photo of it like the one that was posted yesterday[1000x1051][OC]
882,"Overhead view of the layout of the North Carolina-Class battleships, provided by USS North Carolina (BB-55)[566x1000]"
883,"Imperial Brazilian Navy Cruiser Almirante Barroso in Rio de Janeiro, 1888 [2015 x 2500]"
884,U-class submarine HMS Ultimatum leaving the Holy Loch in August 1943[601 x 783]
885,"The former German submarine UB-148 underway in heavy seas, after having been surrendered to the United States. 1919. [2903 × 2167]"
886,"""America's Flagship,"" the aircraft carrier USS Ronald Reagan (CVN 76) Sails in front of Iwo Jima. [2048 X 1367]"
887,USS Missouri squeezing into the Panama Canal [595 x 741]
888,"County-class destroyer HMS Fife (D20) escorts Argentinian tall ship ARA Libertad (Q-2) through the English Channel, 1968.[1124x712]"
889,"USS Iowa BB-61 on its way to San Pedro, CA from Vallejo, CA, June 2012[4288 x 2848]"
