,title
0,Album - Ulithi Atoll and the Central Pacific Fleet of the United States Navy WWII (512 pics) [1234 x 5678]
1,Paul Allen's team found USS Indianapolis CA-35 today! [album]
2,A Sailboat in front of the USS Iowa [1024 × 684]
3,"1/72 scale tower of the battleship Yamato compared to a Tiger tank. completed with 18.1"" shell. [1742 × 1416]."
4,"Two Visby-class corvettes in Stockholm, 2016 [1524x1268]"
5,Italian tall ship Amerigo Vespucci escorted by Luigi Rizzo frigate. [2048x1152]
6,"Soviet space control-monitoring ship Kosmonavt Yuri Gagarin in Odessa, 1971.[900 × 660]"
7,A Typhoon at the Beach. [940x518]
8,The A-10 of gunboats. Just a massive gun with a ship attached [1203 x 724]
9,Mongolian Navy in 2017 [1280 x 720]
10,"American aircraft carrier USS Independence (CV-62) flashed the Italian Amerigo Vespucci with light signal asking Who are you?, the full rigged ship answered Training ship Amerigo Vespucci, Italian Navy. The US ship replied You are the most beautiful ship in the world [979 × 768]"
11,Spanish Flag used by a Ship of the Line in the Battle of Trafalgar [620 x 413]
12,Battlecruiser Peter the Great sailing past Fort Alexander [1199x 899]
13,HMS Hermes returns home to Portsmouth from the Falklands war in 1982 [1000x660]
14,"Two Japanese Coast Guard vessels, JCG Muzuki (PS 11) and (JCG Nobaru PS 16), ram a Chinese boat piloted by activists who had placed a Chinese flag on Uotsuri Island- 8/15/2012 [3500 x 2298]"
15,"North Korean heavy cruiser ""누드를 보내다"" being launched by glorious workers, 2013 [1545×1024]"
16,The final voyage of the USS Iowa [4608 x 3072]
17,"The Orion spacecraft in the well deck of USS Anchorage after being recovered from the Pacific Ocean, 5th December 2014 [3000×1996]"
18,USS Monitor's gun turret being recovered from the sea. [1784×1400].
19,"Japanese battleship ""Yamato"" blows up, following multiple attacks by U.S. Navy carrier planes north of Okinawa, 7 April 1945 [1280×960]"
20,"Free of her tugs, PCU Gerald R. Ford CVN 78 speeds up as she departs on her first sea trials April 8 2017 [3605x2400]"
21,Stunning picture of USS Wisconsin (BB-64) [1920 x 1080]
22,"[Album] Inside a Soviet-era Typhoon class submarine, the largest class of submarine ever built"
23,"USS Wisconsin (BB-64) now a mueseum ship in Norfolk, Virginia [1932×2352]"
24,The U.S. Navy battleship USS Tennessee (BB-43) underway on 12 May 1943. Tennessee was damaged in the Japanese attack on Pearl Harbor 7 December 1941 and was afterwards given a very extensive reconstruction. This gave her the enormous beam apparent in this photograph. [1200x1600]
25,"Ships of the US Navy third fleet anchored at Ulithi during preparations for the invasion of Japan, 1945 [1000 x 750]"
26,F35c Lightning II alongside the USS Zumwalt (706x555)
27,[450 x 338] HMS Invincible Returns to Portsmouth from The Falklands War
28,A view into the well deck of the USS Iwo Jima (LHD-7) as it provides hurricane relief assistance off of Key West [4427 x 2914]
29,English gentleman has built models of every ship in the Royal Navy since WW II using matchsticks and matchbox wood. Link to article and more pics in comments. [964x640]
30,"In honor of her decommissioning 6 days ago, USS Enterprise (CVN-65)"
31,HMS Queen Elizabeth and USS George H. W. Bush [1440x1080]
32,The aircraft carrier USS George Washington sails through calm seas near Guam at sunset while under way in the Pacific Ocean [2546 × 1697]
33,German battleship/cruiser Gneisenau.[883 x 1267]
34,French Battleship Richelieu in the Indian ocean 1944 [2100 × 1326]
35,All 4 Iowa class Battleships steaming together in formation [1024 x 770]
36,"If it works, it ain't stupid... Egyptian Navy using Avenger as short-range air defense system aboard its Mistral-class LHD [800 x 600]"
37,"Nuclear icebreaker 50 Let Pobedy, 2014 [2000 x 1320]"
38,Size comparison of new Russian spy subs with TYPHOON and Ohio Classes [OC][1602x1434]
39,"USS New Jersey (BB-62) transiting the Panama Canal, April 1984.[1500x1009]"
40,Charles de Gaulle going in for mid-life maintenance [639 x 960]
41,"Repost of one of my favorite pictures I've ever seen, USS Lexington (CV-16) Museum on the Bay, Corpus Christi, Texas. The ship that started it all for younger me. [1920x1200]"
42,"USS Constitution‘s 220-year-old original keel, photographed on February 1, 2016. [1024x659]"
43,"How about LEGO? The Japanese surrender aboard the USS Missouri (BB63) First Division Museum, Cantigny Park 2015 [3264 x 2448]"
44,The superstructure of french battleship Richelieu in 1946.[2400 × 1585]
45,The ex-Soviet Cruiser Murmansk wreck off the Norwegian coast (2464x1648)
46,Everything you ever wanted to know (and more) about the Soviet Project 941 Akula SSBN: the TYPHOON [album]
47,"In honor of the 40180th subscriber to our little subreddit, I present to you Iowa's Bathtub! [2860 x 1910] Complete with Navy-approved Synthetic Waterfowl."
48,It's bigger - QE class carrier compared to Invincible class [2000*1346]
49,The Nimitz-class aircraft carrier USS Carl Vinson (CVN-70) departing San Francisco.[4368 × 2912]
50,[1198x680] USS John S. McCain and Fitzgerald in Tokyo Bay 12/5/2017
51,"If we're doing models, here's a 1/10th scale of IJN Yamato at the Kure Naval Museum near Hiroshima [637x949]"
52,"USS New York (BB-34) arrives at New York from the Pacific, circa 19 October 1945. [1980 x 3000]"
53,"Just finished my third battleship model, the Japanese Battleship Nagato in 1/700"
54,73 years ago today a Radioman aboard the USS Ranger (CV-4) received a shocking dispatch [890x721]
55,"Mods are asleep, post French pre-dreads. Colorized image of the battleship Charles Martel [1280 x 885]"
56,"HMS Royal Oak in her resting place, sunk by Gunther Prien's U-47 in Scapa Flow on Oct 14th, 1939. (2187x1285)"
57,"The 'SPQR' shield-figurehead on the prow of the Italian battleship Roma, now lying half-buried in the sand at a depth of about 1,200 meters (photo Guido Gay). [1917 x 845]"
58,Falklands Friday you say? How about an album on the conversion of the S/S Atlantic Conveyor from humble ro-ro to quasi-Aircraft Carrier and her ill-fated mission to the Falkland Islands? [Album]
59,"Typhoon-class SSBN ""Dmitriy Donskoy"" crossing underneath the Storebælt bridge on the way to St. Petersburg [1134 x 756]"
60,"Now hear this: Despite having the worst moderators in recorded history, WarshipPorn has hit 30,000 subscribers."
61,1954 Destroyer Piers Naval Station Norfolk [1161 x 1600]
62,"75 years ago today, USS Hornet sent 16 B-25s off her deck and into history[1100x619]"
63,"£7 for the pair, great find! [3264x2448]"
64,"Tower, this is Ghost rider requesting a flyby. [2464 x 1632]"
65,Bismarck - Stern [860 x 620]
66,"Poster: In 10-minutes a modern U.S. Battleship can deliver projectile weight equivalent to the total bomb load of 120 4-engine bombers, c1944 [2328 x 2646]"
67,"So Paul Allen, co-founder of Microsoft, found the wreck of the IJN battleship Musashi today from his yacht - here's the first view of Musashi's bow crest in over 70 years[1000x563"
68,"A6M Zero about to strike the hull of USS Missouri, April 11th 1945.[960x776]"
69,"HMS Queen Elizabeth dwarfing the town of Invergordon, Scotland [720x540][OS]"
70,"Essex-class carrier Modernization programs, from 1944 to 1960[3218x1793]"
71,"Bismarck firing her main and secondary batteries during the Battle of the Denmark Strait, possibly just after Hood blew up. As seen from Prinz Eugen. [gfy, xpost from /r/MilitaryGfys]"
72,USS Abraham Lincoln (CVN 72) Conducting High-Speed Turn Drills During Sea Trials [1399x933]
73,What 3 carrier strike groups looks like from the perspective of a sailor [2100 x 1500]
74,HMS Nelson Colourised [1600 x 1245]
75,"The most famous ship of the Kriegsmarine, battleship Bismarck in Kiel in late September 1940.[1535x2074]"
76,Not exactly a warship but the Nemesis of many. Color. Soviet mine cleaning party at work. Hope MODs are ok. (859x1218)
77,"Call it a career - After 57 years of exemplary service with two Navies under her belt, the INS Viraat (R22), formerly HMS Hermes (R12), decommissioned on March 6th, 2017. [1865x1052]"
78,B2 overflies three CVBGs after Valiant Shield 2006 [3008 x 2000]
79,World's fastest naval vessel - WP-18 Special Forces Interceptor [1800x1201]
80,The German Bismarck in Kiel in late September 1940.[1535x2074]
81,[78F] Screw me in the aft! [2048x 1316]
82,"A team of four Italian Gruppo Operativo Incurson combat swimmers emerging from a Salvatore Todaro (S526)-class diesel attack submarine [1,600 × 1,065]"
83,The replica trireme OLYMPIAS [2560 x 1920]
84,"14-inch shells on deck of the U.S. Navy battleship USS New Mexico (BB-40), while the battleship was replenishing her ammunition supply prior to the invasion of Guam, July 1944.[4,535 × 5,742]"
85,The Nimitz-class aircraft carrier USS Abraham Lincoln (CVN 72) conducts high speed turn drills during sea trials [3228 x 2152]
86,Dazzle camouflage explained [2185x3017]
87,Launch the alert Tomcats! Two F14s launch off bow and waist catapults [2100 x 1500]
88,Pocket Battleship? Fast Battle...canoe? USS Missouri (BB-63) shaped canoe transiting unknown waters date unknown [700 x 558]
89,"USS Augusta, USS Midway, USS Enterprise, USS Missouri, USS New York, USS Helena, and USS Macon in the Hudson River in New York, New York, United States for Navy Day celebrations, 27 Oct 1945 [1581x1993]"
90,"Japanese Type A-class midget submarine being recovered near the entrance to Pearl Harbor, Hawaii, United States, circa July 1960; its torpedoes had not been fired. [740 × 605]"
91,IJN Aircraft Carrier Amagi capsized in Kure after US Navy planes attacked it on July 1945 (3000x1912)
92,Photograph taken from a TARPS-equipped F-14 Tomcat showing a Soviet Victor III class submarine on the surface. c.1985. [1864 x 1454]
93,HMS Queen Elizabeth aircraft carrier meets Queen Elizabeth 2 ocean liner [1200x800]
94,"""To the memory of the gallant men here entombed and their shipmates who gave their lives in action on December 7, 1941 on the U.S.S. Arizona."" [OC][4003x2659]"
95,"England expects that every man will do his duty. 210 years on from Trafalgar. HMS Victory and HMS Dauntless, the old and the new. [1200 x 801]"
96,Between two Kirov battlecruisers [983px × 768px]
97,"The Admiral Hipper, looking a bit worse for wear at the end of the war. Kiel, May 1945 [800 x 582]"
98,German Imperial Battleship SMS Hindenburg scuttled in Scapa Flow after the surrender of Germany.[600 x 908]
99,"U.S. Marine Corp amphibious assault vehicle launching from the amphibious transport dock ship USS Green Bay (LPD 20), Dec. 19, 2012 [2896×1944]"
100,"The decor of the main gun turret of the battleship Massachusetts, 1890 [3478 x 4250]"
101,USS MIDWAY departs Japan in 1991 to be decommissioned. X-post from r/historyporn. [1920x1271]
102,"For...uh...Seaplane Tender Sunday, here's USS Timbalier with two Martin Mariners, ca. 1948 [1110x891]"
103,[2491×3152] Floating Fortress: USS Massachusetts underway somewhere in the pacific (1943)
104,The last gun cruiser in active service & the flagship of the Peruvian Navy: BAP Almirante Grau (CLM-81) [1024 x 1367]
105,HMS Rose prepares to fire across the bow of an unknown warship [960 × 640]
106,USS Wisconsin parked at the end of the street [2330x1080][OC]
107,USCG Cutter Eagle passes USS Iwo Jima (LHD-7) on the Hudson River during Fleet Week 2002.[1312 × 2000]
108,A glorious photo of a Typhoon class sub under construction. Two pressure hulls and the ICBM section between them clearly visible [729 x 1100]
109,"A frontal view of the ship that revolutionised naval power, HMS Dreadnought.[3563 × 3490]"
110,"[1200x1600] USS Tennessee (BB-43), shortly after her modernisation, May 1943. Colorisation by irootoko_jr."
111,"They're not real ship, but these are all 21 of my US and Soviet 1/350 scale ships and submarines. It took 5 years to finish. VERY image intensive - 118 photos. Enjoy (X/post to Modelmakers)"
112,ROK Naval Academy graduation ceremony [2000 x 1411]
113,"The memorial to the USS Utah (BB-31/AG-16)watching over her remains, Pearl Harbor, 1989[3000x2280]"
114,A sailor fires a shot-line from the amphibious assault ship USS Wasp (LHD 1) to the fast combat support ship USNS Supply (T-AOE 6)[3256 x 2605]
115,USS John S. McCain aboard MV Treasure [2048×1636]
116,"USS Texas, the first US battleship to become a permanent museum ship and the first battleship declared to be a US National Historic Landmark.[706 × 1000]"
117,[1024 x 550] HMS Queen Elizabeth preparing for sea trials which are due to begin in the next few months.
118,DDG-1000 looms in the snowy island seascape [1000x630] photo by Dave Cleaveland
119,"The ARA San Juan, seen here after its refit in 2013 now lost at sea [1000x625]"
120,"US Navy cruisers and destroyers at Balboa harbour, Panama Canal Zone, on 23rd April 1934 [5667×4482]"
121,Russian missile cruiser Varyag aerial top view [1080 × 1349]
122,"SS Pacific Tracker with her massive X-Band radar moored at Honolulu Harbor, 2013 [2250 x 1238]"
123,"Los Angeles-class submarine, USS Oklahoma City (SSN-723) shows of her Mk-45 Vertical Launching System (VLS).[1500 x 929]"
124,HMS Queen Elizabeth finally out of the yard [2048 x 1364]
125,A US Marine Corps F-35B Lightning II hovers over the deck of USS America (LHA 6) during operational evaluations off San Diego last week. [7360x4912]
126,"Sailors abandoning the doomed USS Lexington (CV 2) during the Battle of the Coral Sea, May 8th, 1942. [640x355]"
127,USS Zumwalt the lead ship of it's class [1280×1707]
128,"[GFY; mod approved] Due to complex nature of the maritime border between South and North Korea, naval gun-battles are still fought in waters surrounding the Korean peninsula despite the heavy presence of missiles. (More info in comment) [1280 x 720]"
129,"Typhoon-class SSBN Dmitriy Donskoy escorted by the Kirov-class Battlecruiser Pyotr Velikiy on the Gulf of Finland, July 24th 2017. [1198 x 674]"
130,274mm cannon inside a Colbert class french ironclad 1885 [2510×1570]
131,The Royal Navy's Newest Warship (Queen Elizabeth) Viewed From The Great Cabin of Their Oldest (HMS Victory) In Portsmouth Naval Base [4032x3024]
132,"Soviet experimental submarine ""Forel"", sole member of the Beluga class, used to test hull designs and new propulsion systems. [998 x 687]"
133,Small but fierce. British patrol boats sail out to patrol the English Channel. (590x799)
134,"USS Indianapolis (CA-35). As recently discovered by Paul Allen and team, photo one of the heavy cruiser's 250-ton triple Mk 14 8″/55 gun turrets. [1100 × 619]"
135,"Dmitriy Donskoy, Russian Navy nuclear ballistic missile submarine, Akula class (NATO Typhoon class) under construction. (795x110)"
136,New Mexico-class battleship USS 'Idaho' BB-42 off Kwajalein early 31 January 1944 to soften up shore positions. (Colourised by Richard James Molloy)[957x960]
137,"Must. Go. Faster. F/A-18 engine being tested on the fantail of USS George Washington, 2003 (CVN-73)[2100 x 1500]"
138,First visit to a Naval Museum. USS Wisconsin (BB-64) [4048x3036]
139,Swim call on USS Iwo Jima (LHD-7) in the Gulf of Aden [3883×2912]
140,"The torpedoed Japanese destroyer Yamakaze, as seen through the periscope of an American submarine, USS Nautilus, in June 1942.[1140x900][1140x980]"
141,"USS Carl Vinson (CVN-70), USS Ronald Reagan (CVN-76), and a Hyūga-class DDH; Sea of Japan, today [1200 x 857]"
142,"First aircraft, a Merlin helicopter, lands on HMS Queen Elizabeth [3600 x 2400]"
143,MQ8 Fire Scout Unmanned Helicopter lands on flight deck of Littoral Combat Ship USS Coronado [4107 x 3032]
144,"U-2540 aka ""Wilhelm Bauer"". Nazi-Germany submarine that spent 12 years on the bottom of the ocean before being raised and used by the German federal navy. Belonged to the advanced XXI-class that served as the basis for later American and Soviet submarines"
145,"Nelson-class battleship HMS Rodney, famous for the sinking of Bismarck and being the only battleship in history to have torpedoed another battleship.[1600 × 1128]"
146,"The flagship of the Grand Fleet during WW1 and leadship of her class, HMS Iron Duke.[4316 × 2907]"
147,"Mods area asleep, quick, post pictures of monitors on monitors! [585x425]"
148,"I enjoy Civil War era naval stuff, so I made a model 9"" Dahlgren cannon that shoots 1"" diameter steel ball bearings."
149,French battleship Richelieu in the Indian ocean 1944 [2100 × 1326]
150,"The battleship bombing experiments, as the pro battship partisan sees it and as the pro airplane partisan sees it, Chicago Tribune, 1921 [1986×2546]"
151,"The United States Navy, April 2015 [12000x8000][OC]"
152,French carrier Charles de Gaulle inauguration [1050x700]
153,USS New Jersey (BB-62) Iowa-class battleship firing from the Gulf of Tonkin. North Vietnam 10/1/1968. Photo by Neil Leifer [2000 × 1360]
154,"The Royal Navy in 1939, as published by *The Daily Telegraph.* Ships marked in red were lost by war's end. [2744x1398]"
155,The brand-new USS Colorado (SSN-788) undergoing acceptance trials. [1200 x 803]
156,"USS Nautilus (SSN-571), the world's first nuclear submarine shown at her berth at the Submarine Force Library and Museum. To my knowledge, she's the only complete nuclear vessel on display in the US. [1250x982]"
157,Russian Kirov class battlecruiser Pyotr Velikiy transiting Suez canal [1280 × 857]
158,"Cleveland-class Light Cruiser, 'USS Santa Fe' pulls alongside Essex-class Aircraft Carrier, 'USS Franklin' as it lists towards its starboard side after suffering two direct hits from a pair of armour piercing bombs, dropped by a Japanese plane. Near Okinawa. March 19, 1945. [1243×960]"
159,"USS Ross (DDG-71). You know why this is here. Ross and USS Porter (DDG-78) hit Al Shayrat airbase in Syria with a combined 59 Tomahawk missiles last night, targeting fighters, hardened aircraft shelters, radar equip., ammunition bunkers, fuel storage and air defense systems. [2013 × 1224]"
160,Imperial Russian Navy Black Fleet parade by Ivan Ajwazowski [Art] (2600x1484)
161,"Lieutenant trying to remember where he parked PCU Gerald R. Ford, April 9, 2017 [2100 x 1500]"
162,"150mm gun of the German auxiliary cruiser Kormoran (HSK-8),sunk in 1941 and later rediscovered in 2008 [962×722]"
163,King George V-class battleship HMS Duke of York as she leaves drydock at Rosyth.[856 × 1160]
164,"""HI MOM!"", a heartfelt letter home from the sailors of USS Midway (CV-41) in 1981.[1024x750]"
165,Chilean Navy in Beagle crisis in 1978 [1600 x 1196]
166,"RMS Queen Elizabeth bringing American troops back home, New York harbour 1945 [1280×1596]"
167,Battleship Roma [2562 x 1686]
168,"Carrier launched F4U's and F6F's fly in formation over the USS Missouri and other ships in Tokyo Harbor after the signing of the Japanese Surrender. September 2, 1945 [1375 x 1112]"
169,"Fixed 380mm pneumatic guns of the dynamite gun cruiser USS Vesuvius, 1890's [1375×1100]"
170,The USS Mitscher (DDG 57) next to the French tall ship replica Hermione. The original Hermione brought information to the Continental army that a French army was headed for the United States to assist in the war effort. [3308 x 2202]
171,"View of ""Murderer's Row,"" the carriers Wasp (CV 18), Yorktown (CV 10), Hornet (CV 12), and Hancock (CV 19) anchored in Ulithi Atoll as seen from the carrier Ticonderoga (CV 14). December, 1944. [1915 x 1511]"
172,Side profiles of USS Jimmy Carter versus USS Seawolf [2000 x 688]
173,"HMY Britannia leaving Hong Kong with an impressive escort, 1997, after the hand over to China.[1280 × 720]"
174,"My second battleship model, a 1/700 KGV"
175,Sailboat in front of the USS Iowa [1024 × 684]
176,"Assembling offshore patrol vessel HMCS Harry DeWolf (AOPV 430), lead ship of her class / Halifax, Nova Scotia, 2017 [1200×675]"
177,Map of British Minefields during WWI [2000×2265]
178,[Album] US Navy anti-aircraft guns of WWII
179,"'The Battleship of the Future!' - Popular Mechanics, 1940 [2698 x 2111]"
180,The Ex-Oriskany during its Sinking during 2006. The Essex class carrier was sunk to form an artificial reef off the Florida coast. [4288 x 2848]
181,The guided-missile destroyer USS Zumwalt (DDG 1000) passes national historic site [5287 × 3776]
182,The last battleship ever commissioned : the French Richelieu-class Jean Bart. [2154x1311]
183,Sailors execute a Tactical Snow Angel Formation Exercise (TACSNANEX) on the forward flight deck of the USS Dwight D. Eisenhower (CVN-69) during a January 7th snowstorm in Norfolk. [6407x4451]
184,Battlecruiser HMS Renown with USS Texas astern.[939 × 600]
185,"June 13 2005: The Office of Naval Research Afloat Lab, Starfish (YP-679), pulls alongside the USS Wisconsin at Nauticus [1632x2464]"
186,Construction of the 14 inch guns for USS New York (BB-34) and USS Texas (BB-35).[2000 x 1565]
187,"Indefatigable-class battlecruiser HMS New Zealand at Lyttleton, New Zealand.[1024 × 704]"
188,"[1625 x 1103] The Greek battleship Kilkis in color, probably in Malta. Formerly the USS Mississippi (BB-23)."
189,Diesel fast-attack submarine USS Gudgeon (SS-567) arrives at Pearl Harbor on 21 February 1958 after circumnavigating the globe. [3788×2995]
190,The Missouri (BB-63) at anchor in silhouette in Sydney Harbor for the celebration of the Royal Austrailian Navy 75th anniversary.[1181 × 787]
191,"Russia's guided-missile cruiser Varyag, always imposing somehow. (1389x1875)"
192,USS Zumwalt showing a little forced perspective... but still impressive.[1280x1707]
193,"[1148 x 1592] Italian heavy cruisers on maneuvers, c. 1939. Colorized in HD by Irootoko Jr."
194,"Sealed reactor sections from 77 nuclear submarines, seen in Trench 94 at the Hanford Reservation in 2003.[2000x3049]"
195,Didn't know Korea operated one of these. South Korean navy WIG craft [845 x 390]
196,"I don't know if this counts, but I just 3D printed the USS Iowa (BB-61). [2688x1520]"
197,F4U and F6Fs flying in formation over the USS Missouri while the surrender ceremonies to end World War II take place on board [1247 x 959]
198,USS Zumwalt (DDG 1000) [2796 × 3797]
199,"Negative Ghost Rider, the pattern is full...USAF B-52 demonstrates low altitude flying for sailors of the USS Ranger(CV-61) Persian Gulf 1990 [800 x 554]"
200,Three Astute class subs under construction [2000 x 1125]
201,The Battleship Texas Listing 6 degrees to starboard in the setting sun. (Album in the comments)[4000 x 3000]
202,Lt. Mark Baden lands his A-6 on the USS Abraham Lincoln (CVN-72) after the partial ejection of his BN Lt. Keith Gallagher. [700 x 487]
203,Russian cruiser Aurora [2560×1707]
204,"U-534. Sank by an RAF Bomber in 1945, she is one of only four German WWII submarines in preserved condition in the world. Now a major tourist attraction in my town, Birkenhead, England. [5033 × 2255]"
205,The Naval Railgun FAQ is finished! Here's a taste. [Full FAQ in comments; ask your questions!] [album x46]
206,The remains of Soviet Sverdlov class Cruiser Murmansk [2464 x 1648]
207,"Control room of the German UB 110 submarine, after being sunk and risen in 1918. [1600 × 994]"
208,"USS Ranger, USS Constellation, USS Kitty Hawk and USS Independence all awaitig their fate !!(Mothball fleet,Bremerton,Washington[2048 x 1365]"
209,Having a cookout on top of a moving submarine [1200 x 820]
210,"The US Third Fleet prepares for the invasion of Leyte, 6 October 1944 [2048 × 1541]"
211,"A bow view of South Dakota-class battleship USS Alabama (BB-60), now a museum ship in Mobile Bay.[2848 × 4288]"
212,USS Zumwalt - From aboard the USS Jason Dunham (DDG-109) in Baltimore Harbor [4032 x 3024]
213,USS Zumwalt (DDG 1000) steams alongside USS Independence (LCS 2). [4928 x 3280]
214,Submarine emergency blow [320x240]
215,Messenger line being fired at US Navy supply ship 2014 [4256×2832]
216,"The last cruise, the last launch. F-14D Tomcats stage to depart USS Roosevelt (CVN-71) for the final time before retirement, 2006 [1800 x 1200]"
217,"The CSS Stonewall - a 1,390-ton ironclad built in Bordeaux, France, for the Confederate Navy in 1864 [1920 x 1400]"
218,"USS George H.W. Bush conducting flight operations, date very uncertain [1400x1073]"
219,"Battleship Tirpitz in Kaafjord Norway in July, 1942.[1200 × 699]"
220,"Navalized 20mm AA gun aptly named ""Sea Vulcan"" by the ROK Navy [1527 x 1013]"
221,HMS Queen Elizabeths fat behind[1024X693]
222,"Battleship USS Wisconsin towering over the streets of Norfolk, VA. (X-post r/pics) [940x 1144]"
223,"USS Leyte (CVA 32) squeezing under the Brooklyn Bridge with her mast removed, 19 February 1956 [2626 x 1996]"
224,"Torpedo damage to port side of USS Oklahoma, taken once in the drydock, January 1944 (740x615)"
225,"Battleship Richelieu after repairs at the New York Naval Shipyard, 26-08-1943.[2229 × 2818]"
226,"HMS Rorqual, the most successful minelaying submarine of World War II. Her mines sank 35,951 tons of shipping, including 5 torpedo boats/destroyers, one submarine chaser, two water tankers and six freighters. She also sank another 21,000 tons with gun and torpedoes. [800 x 602]"
227,"Not strictly a warship, but here's a a section of 26"" steel armor intended for use on the Japanese ship IJN Shinano after a ballistics test. The test simulated getting hit by a 16"" shell fired from a U.S. Iowa-class battleship from a range of 13 kilometers. [x-post /r/pics]"
228,Typhoon at the Beach. [940x518]
229,[726 x 834] HMS Furious in August 1941 with four Hurricanes on her flight deck.
230,"[1903 x 1285] Projectile leaving the barrel of USS Missouri, 1990"
231,The sail of the USS Hawkbill (The Devil Boat) SSN 666 sits in the small town of Arco in the middle of Idaho [5312×2988].
232,"Olympias, a reconstruction of an ancient Athenian trireme operated by the Hellenic Navy [1352×900]"
